title,link,description,pubDate,pubTime,crawl_timestamp
Bombardier commits to RM700m local content use in fulfilling Kelana Jaya LRT contracts,http://www.theedgemarkets.com/article/govt-inks-rm217b-contracts-bombardier-consortium-refurbish-supply-new-trains-kelana-jaya-lrt,KUALA LUMPUR (April 23): Bombardier Hartasuma Consortium, the train set supplier for Prasarana Malaysia Bhd's Kelana Jaya Line Light Rail Transit (LRT) has committed to maximise the use of local content to up to 35% in its delivery of 27 new train sets for the project.,2019-04-23,09:52:41,2019-04-23 21:00:00
Barakah gets white knight, creditors' support for debt restructuring, CEO says,http://www.theedgemarkets.com/article/barakah-gets-white-knight-creditors-support-debt-restructuring-ceo-says,Barakah Offshore Petroleum Bhd has secured a white knight to inject fresh capital into the group under the company's plannned debt restructuring.,2019-04-23,09:30:36,2019-04-23 21:00:00
Singapore's finance minister Heng named deputy PM,http://www.theedgemarkets.com/article/singapores-finance-minister-heng-named-deputy-pm,SINGAPORE (Apr 23): Singapore finance minister Heng Swee Keat is set to become deputy prime minister, the prime minister's office said in a statement on Tuesday, strengthening expectations he will take over as the future leader of the city-state.,2019-04-23,08:41:54,2019-04-23 21:00:00
FGV, pilgrims fund said to mull up to US$1b Indonesia sale,http://www.theedgemarkets.com/article/fgv-pilgrims-fund-said-mull-us1b-indonesia-sale,Palm oil giant FGV Holdings Bhd and the Malaysian pilgrims fund are considering selling plantation assets in Indonesia as the government-linked entities seek to improve their financial position, people with knowledge of the matter said.,2019-04-23,08:37:54,2019-04-23 21:00:00
Appeals court reserves judgment on Najib's bid to remove Sri Ram as prosecutor,http://www.theedgemarkets.com/article/appeals-court-reserves-judgment-najibs-bid-remove-sri-ram-prosecutor,The Court of Appeal has deferred its decision on Datuk Seri Najib Razak's bid to disqualify former Federal Court judge Datuk Seri Gopal Sri Ram from leading the prosecution in his 1Malaysia Development Bhd (1MDB) case regarding 25 counts of money laundering and abuse of power involving RM2.28 billion.,2019-04-23,08:27:44,2019-04-23 21:00:00
Bonds rise as regulators seek to calm jitters,http://www.theedgemarkets.com/article/bonds-rise-regulators-seek-calm-jitters,Malaysian bonds rise for the first time in eight days as regulators pledged to deepen onshore markets and said local markets were resilient following last week's sell- off.,2019-04-23,08:23:12,2019-04-23 21:00:00
Hartalega up 7.69% to highest in seven weeks,http://www.theedgemarkets.com/article/hartalega-769-highest-seven-weeks,Hartalega Holdings Bhd shares rose 7.69%, more than any full-day gain since Jan 17, as Malaysia's benchmark index advanced.,2019-04-23,08:17:14,2019-04-23 21:00:00
Tencent-backed live-streaming firm DouYu files for $500 million U.S. IPO,http://www.theedgemarkets.com/article/tencentbacked-livestreaming-firm-douyu-files-500-million-us-ipo,HONG KONG (Apr 23): China's largest live-streaming platform DouYu International Holdings Limited, backed by social media and gaming giant Tencent Holdings Ltd, has filed for a U.S. initial public offering (IPO) of up to $500 million.,2019-04-23,07:32:37,2019-04-23 21:00:00
Abu Dhabi energy firm seeks annulment after RM46m claim against Sime Darby unit rejected,http://www.theedgemarkets.com/article/abu-dhabi-energy-firm-seeks-annulment-after-rm46m-claim-against-sime-darby-unit-rejected,Sime Darby Bhd said Emirates International Energy Services (EMAS) has filed an application at the Abu Dhabi Court of Appeal, seeking the annulment of an arbitration tribunal award.,2019-04-23,07:13:47,2019-04-23 21:00:00
Barakah inks MoU to expand locally and in Middle East,http://www.theedgemarkets.com/article/barakah-inks-mou-expand-locally-and-middle-east,Barakah Offshore Petroleum Bhd has inked a memorandum of understanding (MoU) with the Singapore Catalist Board-listed Vallianz Holdings Ltd for a strategic alliance for both parties to explore business opportunities in Malaysia and the Middle East.,2019-04-23,06:54:36,2019-04-23 21:00:00
Ringgit estimated at RM4 to RM4.15/US dollar at end-2019 -- Lee Heng Guie,http://www.theedgemarkets.com/article/ringgit-estimated-rm4-rm415us-dollar-end2019-%E2%80%94-lee-heng-guie,The ringgit is seen moving between RM4.0605 and RM4.1425 against the US dollar in the near future amid moderating global economic growth expectation as markets take cue from trade friction negotiations, Socio-Economic Research Centre (SERC) executive director Lee Heng Guie says.,2019-04-23,06:38:41,2019-04-23 21:00:00
Good of Pua to 'agree' 1MDB not all doom and gloom,https://www.malaysiakini.com/news/473454,MP SPEAKS |&nbsp;Harapan should follow his advice and not use 1MDB an excuse to renege on their promises.,2019-04-23,12:20:00,2019-04-23 21:00:01
Public urged to hand over works of P Ramlee for preservation,https://www.malaysiakini.com/news/473450,Items can be submitted to Culture Ministry, the National Library and the National Heritage Dept.,2019-04-23,11:50:34,2019-04-23 21:00:01
Was Arun an easy target, asks LFL executive director,https://www.malaysiakini.com/news/473447,Latheefa Koya points out that Court of Appeal Judge Hamid Sultan made the same claim in his affidavit.,2019-04-23,11:17:50,2019-04-23 21:00:01
Car stolen from Narcotics CID chief found in Teluk Intan,https://www.malaysiakini.com/news/473446,Police say&nbsp;the car had been left there for some time but was not disturbed by anyone.,2019-04-23,10:47:33,2019-04-23 21:00:01
Will your taps run dry tomorrow? Use this tool to find out,https://www.malaysiakini.com/news/473445,Klang Valley residents can use M'kini search tool to find out whether water cuts affect them.&nbsp;,2019-04-23,10:41:00,2019-04-23 21:00:01
Ex-French presidential candidate to face trial over fake jobs scandal,https://www.malaysiakini.com/news/473444,His 2017 campaign took a plunge when it was reported that his wife and kids were paid by the senator for work as assistant, lawyers.,2019-04-23,10:40:03,2019-04-23 21:00:01
Najib paid Umno rep kin RM240k to run news portal,https://www.malaysiakini.com/news/473443,Hishammuddin Hussein's nephew says Malaysian Digest dispelled fake news.,2019-04-23,10:35:00,2019-04-23 21:00:01
Give EC power to take action against electoral offenders, NGOs urge,https://www.malaysiakini.com/news/473439,Bersih, Tindak and Engage ask Putrajaya to take a leaf from the book of Indonesia's Bawaslu.,2019-04-23,10:25:00,2019-04-23 21:00:01
Bersih reveals Rantau election offences, chides minister for 'same blood' remark,https://www.malaysiakini.com/news/473437,Bersih chief Thomas Fann says political parties no longer bother about the watchdog's complaints.,2019-04-23,10:06:00,2019-04-23 21:00:01
Najib funded Ah Jib Gor FB page and content writers,https://www.malaysiakini.com/news/473436,NAJIB TRIAL | Prominent businessperson Lim Soon Peng is the proxy for payments.,2019-04-23,10:05:00,2019-04-23 21:00:01
Wang Kelian RCI: ASP was told not to investigate after first body was found,https://www.malaysiakini.com/news/473434,Witness testifies that he was instructed by a senior official not to proceed into probe on sudden death.,2019-04-23,09:59:00,2019-04-23 21:00:01
Jakoa to review MOU with Risda over failure to pay Orang Asli,https://www.malaysiakini.com/news/473431,PARLIAMENT | The authority was engaged to help develop and manage OA rubber plantations.,2019-04-23,09:40:38,2019-04-23 21:00:01
First, indigenous people want their NCR land,https://www.malaysiakini.com/news/473430,COMMENT |&nbsp; Mahathir must understand that handicrafts and agritourism alone cannot solve their problems.,2019-04-23,09:30:22,2019-04-23 21:00:01
Sri Lanka bomb attacks were revenge for New Zealand mosque killings - minister,https://www.malaysiakini.com/news/473426,Junior minister for defence tells parliament that two domestic militant groups were believed to be responsible.,2019-04-23,09:13:59,2019-04-23 21:00:01
Singapore's finance minister Heng named deputy PM,https://www.malaysiakini.com/news/473422,UPDATED 5.09PM | Speculations have been rife that he will be the next prime minister.,2019-04-23,08:54:00,2019-04-23 21:00:01
DNA tests to determine if bone fragments belong to missing runner,https://www.malaysiakini.com/news/473420,The bone fragments were found within the area where Mohammad Ashraf Hassan went missing during a run on March 23.,2019-04-23,08:46:58,2019-04-23 21:00:01
No data conflict between Finance Ministry, Bank Negara on debt,https://www.malaysiakini.com/news/473419,PARLIAMENT | Deputy minister says both reported the debt as 51.8 percent of GDP at end-2018.,2019-04-23,08:34:00,2019-04-23 21:00:01
Najib paid RM150k a month for 'Chinese press monitoring',https://www.malaysiakini.com/news/473417,NAJIB TRIAL | Witness tells the court that the firm was engaged by the late Jamaluddin Jarjis.,2019-04-23,08:30:00,2019-04-23 21:00:02
COA yet to decide on Najib's bid to disqualify Sri Ram,https://www.malaysiakini.com/news/473415,However, the appellate court's decision is expected to be made by May 14.&nbsp;,2019-04-23,08:25:00,2019-04-23 21:00:02
Answering Wee's 'pretentious' questions,https://www.malaysiakini.com/news/473409,MP SPEAKS | I asked about 1MDB scandal, but the MCA president has instead diverted to other issues.,2019-04-23,07:48:00,2019-04-23 21:00:02
'March to Palace of Justice' - lawyers see red over Arun's prison sentence,https://www.malaysiakini.com/news/473407,UPDATED 5.40PM | The apex court's decision courts flak from several lawyers for being excessive.,2019-04-23,07:35:00,2019-04-23 21:00:02
Philippine quake kills 15, rescuers race to find survivors,https://www.malaysiakini.com/news/473405,Most deaths were confined to parts of Pampanga province.,2019-04-23,07:28:37,2019-04-23 21:00:02
M'sia won't be silent on maritime dispute, Uighur issues while boosting China ties,https://www.malaysiakini.com/news/473404,The main focus is on resolving stalled Beijing-backed projects, says Foreign Minister Saifuddin Abdullah.,2019-04-23,07:21:00,2019-04-23 21:00:02
Perak gov't to downsize civil service,https://www.malaysiakini.com/news/473402,The downsizing would be through the abolition of unnecessary and temporary positions, and positions which have been vacant for over two years.,2019-04-23,07:11:57,2019-04-23 21:00:02
The facts of a calamitious betrayal by GPS,https://www.malaysiakini.com/news/473397,MP SPEAKS |&nbsp;The reasons regurgitated by Sarawak coalition are excuses to deflect from the April 9 abstention.,2019-04-23,06:57:00,2019-04-23 21:00:02
Kelana Jaya LRT line to get 27 new train sets,https://www.malaysiakini.com/news/473394,The first is expected to be delivered in Q1 of 2020.,2019-04-23,06:54:35,2019-04-23 21:00:02
Outrageous! AG must explain clearing employer of maid's murder - Paulsen,https://www.malaysiakini.com/news/473386,UPDATED 4.11PM | 'It sends the wrong message, time and time again, that the lives of migrant workers are of no value.',2019-04-23,06:04:00,2019-04-23 21:00:02
Defending Malay rights not racism, says Bersatu amid friendly fire,https://www.malaysiakini.com/news/473381,When P Ramasamy defends Indian students, does this mean DAP is like MIC, asks Bersatu sec-gen Marzuki Yahya.,2019-04-23,05:36:00,2019-04-23 21:00:02
Court rejects bid to recall two expert witnesses in Adib inquest,https://www.malaysiakini.com/news/473380,INQUEST | This is as testimonies given by the HKL experts were satisfying, says the coroner.,2019-04-23,05:33:00,2019-04-23 21:00:02
Minister reminds Sandakan voters of development projects,https://www.malaysiakini.com/news/473378,Lim Guan Eng says the federal government has allocated RM183 million for the district.,2019-04-23,05:22:00,2019-04-23 21:00:02
China's Xi hails 'a new chapter' in Malaysia-China ties after meeting Dr Mahathir,http://www.theedgemarkets.com/article/chinas-xi-hails-new-chapter-malaysiachina-ties-after-meeting-dr-mahathir,The meeting between Malaysian Prime Minister Tun Dr Mahathir Mohamad with China's top leaders today ahead of the Belt and Road Forum marked a new milestone in the story of the two countries' bilateral relationship, which looks set to deepen.,2019-04-25,13:28:19,2019-04-25 22:46:59
Malaysia signs framework agreement to reinstate the revival of Bandar Malaysia,http://www.theedgemarkets.com/article/malaysia-signs-framework-agreement-reinstate-revival-bandar-malaysia,Malaysia has signed a framework of agreement with China this afternoon to revive the former's Bandar Malaysia project -- the massive real estate development at the former air-base near Sungai Besi.,2019-04-25,10:12:29,2019-04-25 22:46:59
FBM KLCI declines as investors take profit,http://www.theedgemarkets.com/article/fbm-klci-declines-investors-take-profit,The FBM KLCI closed down 2.33 points or 0.14% today at 1,635.68 after investors took profit following the index's substantial gain yesterday.,2019-04-25,09:54:18,2019-04-25 22:46:59
Malaysia to supply at least 1.9 mil more tonnes of palm oil to China,http://www.theedgemarkets.com/article/malaysia-supply-least-19-mil-more-tonnes-palm-oil-china,BEIJING (April 25): Malaysia is likely to reverse the trend of declining palm oil export to China, which has persisted for the past six years.,2019-04-25,09:51:56,2019-04-25 22:46:59
Dr Mahathir: Malaysia will continue to be friendly to foreign investors,http://www.theedgemarkets.com/article/dr-mahathir-malaysia-will-continue-be-friendly-foreign-investors,Tun Dr Mahathir Mohamad has reassured the Chinese business community here that Malaysia will continue to retain a business-friendly attitude with foreign investors.,2019-04-25,09:28:24,2019-04-25 22:46:59
Khazanah Research: Comparable property valuation leads to inflated prices,http://www.theedgemarkets.com/article/khazanah-research-comparable-property-valuation-leads-inflated-prices,Housing price discovery using the sales comparison approach is one of the reasons prices of residential units are inflated in certain parts of Malaysia, according to Khazanah Research Institute (KRI).,2019-04-25,09:05:22,2019-04-25 22:46:59
AmBank manager: Najib did not complain about transactions in his accounts,http://www.theedgemarkets.com/article/ambank-manager-najib-did-not-complain-about-transactions-his-accounts,AmBank Jalan Raja Chulan branch manager R Uma Devi told the High Court here that former premier Datuk Seri Najib Razak did not make any complaints regarding the transactions in his five accounts, including those where he allegedly received huge sums of money and also issuing cheques.,2019-04-25,08:09:55,2019-04-25 22:46:59
Petronas Dagangan increases FY19 capex to RM500m,http://www.theedgemarkets.com/article/petronas-dagangan-increases-fy19-capex-rm500m,Petronas Dagangan Bhd increased its capital expenditure (capex) allocation to about RM500 million for financial year ending Dec 31, 2019 (FY19) from some RM300 million in FY18, to refurbish existing petrol stations and Mesra convenience stores. ,2019-04-25,07:38:47,2019-04-25 22:46:59
Nestle Malaysia budgets RM220m for FY19 capex -- its highest in 5 years,http://www.theedgemarkets.com/article/nestl%C3%A9-malaysia-budgets-rm220m-fy19-capex-%E2%80%94-its-highest-5-years,Nestle Malaysia Bhd, Malaysia's largest food and beverage company, has budgeted RM220 million capital expenditure (capex) for this year. The amount of capex allocated is the highest in five years, says chief executive officer Juan Aranols.,2019-04-25,07:26:54,2019-04-25 22:46:59
Spurned by Washington, North Korea's Kim seeks a friend in Putin,http://www.theedgemarkets.com/article/spurned-washington-north-koreas-kim-seeks-friend-putin,VLADIVOSTOK, Russia (Apr 25): North Korean leader Kim Jong Un met Russian President Vladimir Putin on Thursday at a summit designed to show that Washington is not the only power able to set the agenda on Pyongyang's nuclear program.,2019-04-25,06:23:40,2019-04-25 22:47:00
Leong Hup International eyes RM275m from IPO for expansion,http://www.theedgemarkets.com/article/leong-hup-international-eyes-rm275m-ipo-expansion,Leong Hup International Bhd, en route for a Main Market relisting on May 16, announced today it is aiming to raise funds of up to RM275 million from its initial public offering (IPO) to support its domestic and regional expansion moving forward.,2019-04-25,06:07:42,2019-04-25 22:47:00
Maybank's Etiqa FY18 gross premium up at RM7.2b amid challenging year,http://www.theedgemarkets.com/article/maybanks-etiqa-fy18-gross-premium-rm72b-amid-challenging-year,Etiqa Group Insurance & Takaful closed its financial year ended Dec 31, 2018 (FY18) with 17% gross premium growth at RM7.2 billion from a year earlier and a 19% drop in profit before taxation (PBT) at RM825 million against a backdrop of global economic uncertainty.,2019-04-25,05:33:12,2019-04-25 22:47:00
NetX inks deal for online ticketing technology,http://www.theedgemarkets.com/article/netx-inks-deal-online-ticketing-technology,NetX Holdings Bhd is collaborating with Buy Tickets Sdn Bhd (BuyTickets) for the technology of the latter's online ticketing website or platform known as buytickets.com.my.,2019-04-25,05:27:02,2019-04-25 22:47:00
Lafarge, HeiTech, TSR, BIMB, Dophin, Litrak, G3, Ekovest, PLS,http://www.theedgemarkets.com/article/lafarge-heitech-tsr-bimb-dophin-litrak-g3-ekovest-pls,KUALA LUMPUR (April 25): ,2019-04-25,05:23:06,2019-04-25 22:47:00
China seeks to allay Belt and Road debt concerns,http://www.theedgemarkets.com/article/china-seeks-allay-belt-and-road-debt-concerns,BEIJING (Apr 25): China aims to make the Belt and Road initiative sustainable and prevent debt risks, its finance minister said on Thursday, seeking to allay criticism that the infrastructure plan to boost trade and investment creates a heavy burden for some nations.,2019-04-25,05:08:38,2019-04-25 22:47:00
Saifuddin: I rate my performance 6.5 out of 10,https://www.malaysiakini.com/news/473757,&nbsp;INTERVIEW | Nevertheless, the domestic trade minister is confident of achieving full marks in less than two years.,2019-04-25,14:10:00,2019-04-25 22:47:00
SRC trial set to expose a lot of people, says Shafee,https://www.malaysiakini.com/news/473755,Lead defence counsel&nbsp;says this will demonstrate ex-PM was a victim of manipulation.,2019-04-25,13:27:00,2019-04-25 22:47:00
Crown prince meets Johor speaker amid constitution debate,https://www.malaysiakini.com/news/473751,The meeting comes in the wake of the PM claims regarding the state's constitution.,2019-04-25,12:43:01,2019-04-25 22:47:00
Proactive measures for smoother financial market, Dewan Negara told,https://www.malaysiakini.com/news/473749,This includes requiring most foreign exchange export proceeds to be converted into ringgit, says deputy minister Eddin Syazlee Shith.,2019-04-25,11:56:00,2019-04-25 22:47:00
Guan Eng: Sabahans' support for Harapan crucial to restore MA63 status,https://www.malaysiakini.com/news/473746,Finance minister urges locals not to support opposition, as it had 'rejected efforts' to restore Sabah and Sarawak's status.&nbsp;,2019-04-25,11:23:09,2019-04-25 22:47:00
'Dept's decision to again postpone ban on cheap liquor shocking',https://www.malaysiakini.com/news/473745,The Malaysian Anti-Cheap Liquor Movement call for immediate enforcement.,2019-04-25,11:19:00,2019-04-25 22:47:00
China to boost M'sian palm oil imports, invest in biojet fuel plant,https://www.malaysiakini.com/news/473744,M'sian Primary Industry Ministry says China will buy extra 1.9m tonnes of palm oil and invest at least RM2b in plant.&nbsp;&nbsp;,2019-04-25,11:11:38,2019-04-25 22:47:00
Investment analysts told to get their facts right,https://www.malaysiakini.com/news/473743,Deputy Minister Ong Kian Ming says it's good that analysts realise their mistakes, but prefers UBS Singapore's clarification to have come earlier.,2019-04-25,11:02:39,2019-04-25 22:47:00
Bang us hard if arrogant, Anwar tells social media users,https://www.malaysiakini.com/news/473742,Malaysians have the right to criticise leaders who go against the aspirations of the people, he says.,2019-04-25,10:59:00,2019-04-25 22:47:00
Matriculation spike will cause more problems, warns DAP group,https://www.malaysiakini.com/news/473737,The influx could crowd out STPM holders seeking placement in local public universities, they say.,2019-04-25,10:29:00,2019-04-25 22:47:00
Former Vice President Joe Biden to make third run for the White House,https://www.malaysiakini.com/news/473736,His candidacy will face numerous questions, including whether he is too old for a Democratic Party yearning for fresh faces.,2019-04-25,10:27:27,2019-04-25 22:47:00
We saved TH, Felda but others named 'defenders' of Malays, Islam - minister,https://www.malaysiakini.com/news/473735,INTERVIEW | That's a paradox, muses Domestic Trade and Consumer Affairs Minister Saifuddin Nasution.,2019-04-25,10:23:00,2019-04-25 22:47:01
Account number of a M'sian found at Wang Kelian camp,https://www.malaysiakini.com/news/473732,WANG KELIAN RCI | Special Branch officer testifies the notebook also contained names and telephone numbers.,2019-04-25,10:16:00,2019-04-25 22:47:01
Karma of race politics bites Harapan, says PSM,https://www.malaysiakini.com/news/473730,Arutchelvan urges the coalition to be brave in cultivating a new culture based on equality and compassion for disadvantaged groups.,2019-04-25,10:02:00,2019-04-25 22:47:01
Malaysia is a friend of China, welcomes more investments - Dr Mahathir,https://www.malaysiakini.com/news/473726,Despite a change of government, the policy regarding business and investments remains largely the same.,2019-04-25,09:29:00,2019-04-25 22:47:01
Matriculation seat increase a temporary solution - Anwar,https://www.malaysiakini.com/news/473724,There is a need to fulfil the gov't's promise to Indians while assuaging the fears of Malays, says PKR chief.,2019-04-25,09:22:00,2019-04-25 22:47:01
Don't meddle with Johor Islamic affairs - TMJ,https://www.malaysiakini.com/news/473723,He also said the setting up of the Johor Halal Council is to regulate the halal industry and promote its products.,2019-04-25,09:09:25,2019-04-25 22:47:01
Anwar advises Islamic bodies to be vigilant against terrorist groups,https://www.malaysiakini.com/news/473719,PKR chief says&nbsp;Islam promotes harmony and opposes all forms of violence.,2019-04-25,09:01:00,2019-04-25 22:47:01
Wang Kelian: VAT 69 commandos found 14 tents during operation,https://www.malaysiakini.com/news/473718,WANG KELIAN RCI | Witness says&nbsp;the team also arrested five undocumented migrants 200m away from the camp.,2019-04-25,08:58:00,2019-04-25 22:47:01
Matriculation - affirmative action based on needs or ethnicity?,https://www.malaysiakini.com/news/473716,COMMENT |&nbsp;The Harapan government has to make it clear which route it wants to pursue.,2019-04-25,08:53:14,2019-04-25 22:47:01
China's largest copper producer mulls setting up plant in Sabah,https://www.malaysiakini.com/news/473714,Jiangxi Copper plans to use copper scrap rather than copper concentrate as raw material, but is still evaluating the supply.,2019-04-25,08:39:34,2019-04-25 22:47:01
Granddaughter disagreed with Dr M running as PM again,https://www.malaysiakini.com/news/473712,However, filming her grandfather for a documentary inspired awe and gave her new perspective.,2019-04-25,08:36:00,2019-04-25 22:47:01
Sg Kim Kim pollution: Another suspect charged,https://www.malaysiakini.com/news/473711,The S'pore national pled not guilty to abetting three others in disposing waste into the river.,2019-04-25,08:35:45,2019-04-25 22:47:01
NGO proposes house price control, but developers disagree,https://www.malaysiakini.com/news/473707,UPDATED 5.06PM | Housebuyers association claims developers&nbsp;are the cause for the high price of houses.,2019-04-25,08:01:00,2019-04-25 22:47:01
Don't mistake passivity for inefficiency - minister tells detractors,https://www.malaysiakini.com/news/473705,INTERVIEW | It just means she's more focussed on her ministerial duties than on commenting on politics, says Rina Harun.,2019-04-25,07:51:00,2019-04-25 22:47:01
Forensic expert denies threatening other witnesses in Adib's inquest,https://www.malaysiakini.com/news/473703,This comes after two other expert witnesses lodged a police report claiming they were threatened.,2019-04-25,07:48:00,2019-04-25 22:47:01
Khazanah research: Owning a home becoming unrealistic goal for most,https://www.malaysiakini.com/news/473700,Median house price for Malaysia grew 23.5 pct for years when median household income grew only 11.17 pct.,2019-04-25,07:33:00,2019-04-25 22:47:02
Muhyiddin: To mend ties, sultan must not 'disturb' state administration,https://www.malaysiakini.com/news/473698,UPDATED 3.39PM | He says Johor ruler must admit that he has done things that have caused unease.,2019-04-25,06:53:00,2019-04-25 22:47:02
Regressive matriculation policy perpetuates discrimination,https://www.malaysiakini.com/news/473696,COMMENT |&nbsp;It is time for the education minister to turn his attention to equitable education access for all.,2019-04-25,06:50:00,2019-04-25 22:47:02
Yellow Ribbon project and future leaders school among Harapan success stories,https://www.malaysiakini.com/news/473694,Syed Saddiq says the projects have taken off well and are having a positive effect.,2019-04-25,06:33:23,2019-04-25 22:47:02
Proton secures RM1.88b loan from China Construction Bank for R&D and infrastructure development,http://www.theedgemarkets.com/article/proton-secures-rm188b-loan-china-construction-bank-rd-and-infrastructure-development,China Construction Bank (CCB) is lending RM1.88 billion to Proton Holdings Bhd to finance its research and development (R&D) as well as infrastructure development.,2019-04-26,12:30:19,2019-04-26 22:31:30
