title,link,description,pubDate,pubTime,crawl_timestamp
Malaysia not declaring a trade war against EU, says PM,http://www.theedgemarkets.com/article/malaysia-not-declaring-trade-war-against-eu-says-pm,Malaysia is not launching a trade war against the European Union (EU) but is only making known to the world the problems Malaysia is facing due to the bloc's decision to ban palm oil usage in biofuels, says Prime Minister Tun Dr Mahathir Mohamad.,2019-03-26,13:08:50,2019-03-26 21:45:03
KLCI closes marginally higher, sentiment remains fragile,http://www.theedgemarkets.com/article/klci-closes-marginally-higher-sentiment-remains-fragile,The FBM KLCI closed marginally higher today although investors continued to be jittery after the US yield curve inverted last Friday for the first time since 2007.,2019-03-26,10:28:54,2019-03-26 21:45:03
Japan's cabinet approves regulations for planned casinos,http://www.theedgemarkets.com/article/japans-cabinet-approves-regulations-planned-casinos,Japanese Prime Minister Shinzo Abe's cabinet approved regulations for gambling resorts, the first of which could open in Osaka as soon as 2024 and provide a new source of tax revenue.,2019-03-26,09:51:15,2019-03-26 21:45:03
Nurul Izzah defends her stance in calling Dr Mahathir a dictator,http://www.theedgemarkets.com/article/nurul-izzah-defends-her-stance-calling-dr-mahathir-dictator,PKR's Nurul Izzah Anwar, who recently came under fire from PPBM leaders over an interview with Singapore's ,2019-03-26,09:14:55,2019-03-26 21:45:03
The charismatic bankrupt who pulled the strings behind Singapore's largest stock manipulation scandal,http://www.theedgemarkets.com/article/charismatic-bankrupt-who-pulled-strings-behind-singapores-largest-stock-manipulation-scandal,Garbed in purple overalls, John Soh Chee Wen cuts a relaxed figure as he takes his seat. The garment falls fittingly on his athletic frame, not unlike a designer suit. It could well have made a fashion statement, save for the word "prisoner" emblazoned in white across the back.,2019-03-26,08:33:43,2019-03-26 21:45:03
Uber buys rival Careem in $3.1 billion deal to dominate ride-hailing in Middle East,http://www.theedgemarkets.com/article/uber-buys-rival-careem-31-billion-deal-dominate-ridehailing-middle-east,SAN FRANCISCO (Mar 26): Global ride-hailing firm Uber Technologies Inc will spend $3.1 billion to acquire Middle East rival Careem, buying dominance in a competitive region ahead of a hotly anticipated initial public offering.,2019-03-26,07:26:04,2019-03-26 21:45:03
Anwar Ibrahim reaffirms his support for Dr Mahathir,http://www.theedgemarkets.com/article/anwar-ibrahim-reaffirms-his-support-dr-mahathir,Port Dickson MP Datuk Seri Anwar Ibrahim has reiterated his support for Prime Minister Tun Dr Mahathir Mohamad and his government today, following a remark by Permatang Pauh MP, and his daughter, Nurul Izzah Anwar to a Singaporean daily that she was dissatisfied with Pakatan Harapan's governance.,2019-03-26,07:06:11,2019-03-26 21:45:03
'Abenomics' architect predicts Japan to go ahead with sales tax hike,http://www.theedgemarkets.com/article/abenomics-architect-predicts-japan-go-ahead-sales-tax-hike,TOKYO (Mar 26): Japanese Prime Minister Shinzo Abe will likely proceed with a scheduled sales tax hike in October even though slowing global demand and soft wage growth could weigh on the economy, one of the architects of the premier's stimulus policies said.,2019-03-26,06:34:38,2019-03-26 21:45:03
Bring natural gas price down quickly, glove makers urge Gas Malaysia, TNB,http://www.theedgemarkets.com/article/bring-natural-gas-price-down-quickly-glove-makers-urge-gas-malaysia-tnb,KUALA LUMPUR (March 26): Rubber glove manufacturers have called on Gas Malaysia Bhd and Tenaga National Bhd (TNB) to revise the natural gas tariff to be in line with the international prices of liquefied natural gas (LNG) and coal.,2019-03-26,06:27:39,2019-03-26 21:45:03
China's ShFE launches crude oil futures index; plans more products,http://www.theedgemarkets.com/article/chinas-shfe-launches-crude-oil-futures-index-plans-more-products,BEIJING (Mar 26): China's Shanghai Futures Exchange (ShFE) will start on Tuesday publishing an index linked to the prices of its crude oil futures contracts, a year after the launch of futures trading, the ShFE said in a release posted on its WeChat channel.,2019-03-26,06:27:36,2019-03-26 21:45:03
RM60 commemorative bills not replacing RM50 notes, says Guan Eng,http://www.theedgemarkets.com/article/rm60-commemorative-bills-not-replacing-rm50-notes-says-guan-eng,Finance Minister Lim Guan Eng has clarified that the RM60 commemorative bills are not going to replace the existing RM50 banknotes.,2019-03-26,05:48:19,2019-03-26 21:45:03
Airbus wins China order for 300 jets as Xi visits France,http://www.theedgemarkets.com/article/airbus-wins-china-order-300-jets-xi-visits-france,PARIS (Mar 26): Airbus signed a deal worth tens of billions of dollars on Monday to sell 300 aircraft to China, coinciding with a visit to Europe by Chinese President Xi Jinping and matching a China record held by U.S. rival Boeing.,2019-03-26,05:32:47,2019-03-26 21:45:03
Cashless system can help reduce corruption, says Guan Eng,http://www.theedgemarkets.com/article/cashless-system-can-help-reduce-corruption-says-guan-eng,Finance Minister Lim Guan Eng said the application of a cashless system in Malaysia could potentially reduce the possibility of corruption.,2019-03-26,05:20:22,2019-03-26 21:45:04
Tabung Haji SPV has not liquidated any assets, says Mujahid,http://www.theedgemarkets.com/article/tabung-haji-spv-has-not-liquidated-any-assets-says-mujahid,KUALA LUMPUR (March 26): The Ministry of Finance (MoF)'s special purpose vehicle (SPV) Urusharta Jemaah Sdn Bhd has not liquidated any of the Lembaga Tabung Haji (LTH) assets under its management, said Minister in the Prime Minister's Department Datuk Seri Dr Mujahid Yusof Rawa.,2019-03-26,05:13:44,2019-03-26 21:45:04
Armada, Scomies, Komarkcorp, Rexit, Siggas, Straits Inter Logistics,http://www.theedgemarkets.com/article/armada-scomies-komarkcorp-rexit-siggas-straits-inter-logistics,KUALA LUMPUR (March 26): ,2019-03-26,05:05:46,2019-03-26 21:45:04
M'sian doctor to treat deaf boy hero of Lombok earthquake,https://www.malaysiakini.com/news/469687,Dr Lokman Saim says he will conduct a test this week to see if he can restore Taufik's hearing.,2019-03-26,13:40:56,2019-03-26 21:45:04
Dr M says Malaysia keen on new jets, but not ready to buy,https://www.malaysiakini.com/news/469684,PM notes that the RMAF's existing aircraft are well-serviced and can continue to perform.,2019-03-26,13:12:00,2019-03-26 21:45:04
India, Pakistan blame each other after Dr M forced on longer flight path,https://www.malaysiakini.com/news/469678,Prime minister's original flight route to Pakistan last week had been rejected.,2019-03-26,12:28:00,2019-03-26 21:45:04
Australian prosecutors seek jail for media over Pell trial coverage,https://www.malaysiakini.com/news/469677,Journalists and media outlets accused of contempt for covering the cardinal's sex abuse trial.,2019-03-26,11:14:38,2019-03-26 21:45:04
Legal eagles sink claws into Zakir Naik's status over latest allegations,https://www.malaysiakini.com/news/469675,'I just cannot understand the government giving someone like this permanent residence,' says Ambiga.,2019-03-26,11:02:00,2019-03-26 21:45:04
Nurul respects Kiandee, but maintains stance on PAC leadership,https://www.malaysiakini.com/news/469671,'We worked very well with him, but at the end of the day, the structure must prevail.',2019-03-26,10:41:00,2019-03-26 21:45:04
Report on separating powers of AG, public prosecutor ready soon,https://www.malaysiakini.com/news/469668,PARLIAMENT | It will be tabled at a cabinet meeting in the middle of this year, says Liew Vui Keong.,2019-03-26,10:29:00,2019-03-26 21:45:04
Gov't wants more info from AP holders after qualification poser,https://www.malaysiakini.com/news/469666,PARLIAMENT | This after an allegedly dormant company was picked for the lucrative permits.,2019-03-26,10:15:00,2019-03-26 21:45:04
Ministry launches child sex offender registry,https://www.malaysiakini.com/news/469663,Deputy minister Hannah Yeoh says there are 3,000 names on the registry at present.,2019-03-26,09:57:00,2019-03-26 21:45:04
Nothing new in calling Dr M 'former dictator', says Nurul,https://www.malaysiakini.com/news/469664,The PKR lawmaker states that she has made similar remarks in the past.,2019-03-26,09:57:00,2019-03-26 21:45:04
Hadi sees no issue with ratifying Rome Statute, invokes Dr M,https://www.malaysiakini.com/news/469658,PAS president quotes premier's statement, says treaty is loose agreement which M'sia won't follow blindly.&nbsp;,2019-03-26,09:33:00,2019-03-26 21:45:04
Special court will deal with Agong, not ICC: lawyer,https://www.malaysiakini.com/news/469657,Human rights advocate Edmund Bon dismisses concerns Rome Statute will affect the position of Malay rulers.,2019-03-26,09:31:00,2019-03-26 21:45:04
Master of cryptic tweets Azmin goes 'Hahaha',https://www.malaysiakini.com/news/469656,Twitter-jaya's speculation-mill goes on overdrive over PKR's top 2.,2019-03-26,09:25:00,2019-03-26 21:45:05
Najib's query leads to shouting match when Guan Eng raises 1MDB,https://www.malaysiakini.com/news/469651,UPDATED 5.37PM | PARLIAMENT| The finance minister trades barbs with the opposition over the national debt figures.,2019-03-26,09:08:00,2019-03-26 21:45:05
Najib 'escapes' via tunnel when pursued by Guan Eng on HK sale,https://www.malaysiakini.com/news/469643,PARLIAMENT | This comes after Najib expresses concern over the sale of the Malaysia Building in Hong Kong.,2019-03-26,08:40:00,2019-03-26 21:45:05
Mat Sabu thinks Dr M is 'too democratic' at times,https://www.malaysiakini.com/news/469642,'Unfair for certain quarters to accuse Mahathir of making unilateral decisions,' says the minister.,2019-03-26,08:39:00,2019-03-26 21:45:05
Maszlee denies telling Pasir Gudang schools to replace lost days,https://www.malaysiakini.com/news/469637,Decision will be made by Johor Education Dept and Pasir Gudang Education Office, he says.,2019-03-26,08:15:28,2019-03-26 21:45:05
Japanese consulate refers war memorial controversy to Tokyo,https://www.malaysiakini.com/news/469636,Consulate-general's office says awaiting further instructions from Japan, won't respond to calls to remove monument.,2019-03-26,08:12:00,2019-03-26 21:45:05
Opposition MP insists royal consent needed for Rome Statute,https://www.malaysiakini.com/news/469635,Reezal Merican says Saifuddin's answer in Parliament makes it seem as if king's consent was not sought.,2019-03-26,08:08:00,2019-03-26 21:45:05
PAS questions AG's role in Orang Asli suit against K'tan state gov't,https://www.malaysiakini.com/news/469634,The AG is an institution, he cannot isolate himself, says PAS sec-gen Takiyuddin Hassan.,2019-03-26,08:02:00,2019-03-26 21:45:05
MCA backs Anwar on economic agenda, asks if DAP with him or Azmin,https://www.malaysiakini.com/news/469632,Ti Lian Ker claims that Kit Siang, Guan Eng and all DAP leaders have lost their voices.,2019-03-26,07:56:40,2019-03-26 21:45:05
Conor McGregor announces shock retirement from MMA,https://www.malaysiakini.com/news/469631,This, however,&nbsp; is the second time the 30-year-old has announced on Twitter that he has throwing in the towel.&nbsp;,2019-03-26,07:50:00,2019-03-26 21:45:05
Navy's role not limited to national security - Mohamad Sabu,https://www.malaysiakini.com/news/469629,It also plays a key role in nation building as the nation's maritime interests are directly linked to the economy, says defence minister.&nbsp;,2019-03-26,07:40:00,2019-03-26 21:45:05
Straight line injury on Adib's back 'not by parang',https://www.malaysiakini.com/news/469628,UPDATED 6.50PM | INQUEST | Forensic specialist also says the injury occurred when the fireman was standing.,2019-03-26,07:39:00,2019-03-26 21:45:05
Harapan and my family back Dr M as PM: Anwar,https://www.malaysiakini.com/news/469622,UPDATED 4.15PM | Anwar said doubts cast on his daughter Nurul Izzah Anwar's support for Mahathir were unfounded. ,2019-03-26,07:19:00,2019-03-26 21:45:05
Forensics expert hit by online slurs in wake of dispute by 'nurse',https://www.malaysiakini.com/news/469621,INQUEST | Dr Ahmad Hafizam Hasmi says he was accused of lying in his testimony on firefighter Adib's injuries.,2019-03-26,07:14:00,2019-03-26 21:45:06
MACC looking into Customs' alleged involvement in smuggling,https://www.malaysiakini.com/news/469619,This follows a Malaysiakini report of a new smuggling modus operandi involving the help of custom officers.,2019-03-26,07:01:00,2019-03-26 21:45:06
'K'tan has never banned alcohol sale for non-Muslims',https://www.malaysiakini.com/news/469617,PAS sec-gen Takiyuddin Hassan claims earlier statement on the issue was misreported by a non-Malay daily.,2019-03-26,06:57:00,2019-03-26 21:45:06
Needs-based economic agenda remark not aimed at Azmin, says Anwar,https://www.malaysiakini.com/news/469613,The PKR president says the Malays are wrong to think a colour-blind policy will marginalise them.,2019-03-26,06:39:00,2019-03-26 21:45:06
'It's PAS, not Harapan, that promised to abolish PTPTN',https://www.malaysiakini.com/news/469612,Terengganu Harapan chief says Harapan's pledge was to defer repayments from borrowers earning less than RM4k a month.,2019-03-26,06:19:00,2019-03-26 21:45:06
BNM Annual Report 2018 Highlights,http://www.theedgemarkets.com/article/bnm-report-summary-0,The following are the highlights of Bank Negara Malaysia (BNM)'s ,2019-03-27,14:36:00,2019-03-27 22:58:09
No deflation in Malaysia, no recession in US -- BNM governor,http://www.theedgemarkets.com/article/no-deflation-malaysia-no-recession-us-%E2%80%94-bnm-governor,Bank Negara Malaysia's (BNM) governor Datuk Nor Shamsiah Mohd Yunus brushed aside growing concern about deflation arising from the drop in Consumer Price Index for two consecutive months.,2019-03-27,11:00:25,2019-03-27 22:58:09
FBM KLCI at year's low in the absence of positive catalysts,http://www.theedgemarkets.com/article/fbm-klci-years-low-absence-positive-catalysts,The FBM KLCI continued to head south today in the absence of positive catalysts to spark buying interest.,2019-03-27,10:52:49,2019-03-27 22:58:09
Growth in loan disbursement accelerates to four-year high of 7.3% in 2018,http://www.theedgemarkets.com/article/growth-loan-disbursement-accelerates-fiveyear-high-73-2018,Banks are lending. The growth in loan disbursement was at 7.3% in 2018, the fastest pace since 2014, indicating banks are not reluctant to give out loans, according to Bank Negara Malaysia (BNM).,2019-03-27,10:27:41,2019-03-27 22:58:09
Value of mobile banking transactions doubled in 2018,http://www.theedgemarkets.com/article/value-mobile-banking-transactions-doubled-2018,Bank Negara Malaysia (BNM) said the monetary value of mobile banking financial transactions doubled to RM100.1 billion last year, with 257.4 million transactions, from RM50.7 billion with 107.7 million transactions in 2017.,2019-03-27,09:54:26,2019-03-27 22:58:09
BNM further liberalises forex administration framework,http://www.theedgemarkets.com/article/bnm-further-liberalises-forex-administration-framework,Bank Negara Malaysia (BNM) has announced a further liberalisation in the foreign exchange administration (FEA) framework to provide greater hedging flexibility for residents to better manage their foreign exchange (forex) risk.,2019-03-27,09:14:31,2019-03-27 22:58:09
AirAsia X blames ex-local partner on late payments to Nepal's airport,http://www.theedgemarkets.com/article/airasia-x-blames-exlocal-partner-late-payments-nepals-airport,KUALA LUMPUR (March 27): AirAsia X Bhd (AAX) said today the overdue payments claimed by the Civil Aviation Authority of Nepal (CAAN) are due to long outstanding payments that were not made by its former local partner in Nepal - Incentive Group of Companies (IGC) - and this was only communicated to AAX last year by CAAN.,2019-03-27,09:05:34,2019-03-27 22:58:10
Hearing of Najib's SRC case set to start after Federal Court lifts stay,http://www.theedgemarkets.com/article/stay-najibs-src-trial-set-aside,The Federal Court today set aside the stay order granted by the Court of Appeal last week to temporarily halt former premier Datuk Seri Najib Razak's trial involving RM42 million of SRC International Sdn Bhd funds.,2019-03-27,08:06:04,2019-03-27 22:58:10
The Chinese impact on Asian exports,http://www.theedgemarkets.com/article/chinese-impact-asian-exports,<div class="field field-name-field-image field-type-image field-label-hidden"><div class="field-items"><div class="field-item even" rel="og:image rdfs:seeAlso" resource="https://assets.theedgemarkets.com/styles/medium/s3/infogprhic-mm66-tem1259-thumb_theedgemarkets.jpg?null&amp;itok=Dh_Yn3EI"><a href="/article/chinese-impact-asian-exports"><img typeof="foaf:Image" src="https://assets.theedgemarkets.com/styles/medium/s3/infogprhic-mm66-tem1259-thumb_theedgemarkets.jpg?null&amp;itok=Dh_Yn3EI" width="747" height="498" alt="The Chinese impact on Asian exports" /></a></div></div></div><div class="field field-name-body field-type-text-with-summary field-label-hidden"><div class="field-items"><div class="field-item even" property="content:encoded"><div id="article-slider" class="owl-carousel"><!--Image Zoom --><div class="image-gallery"><p class="text-left pull-left"><i class="fa fa-right fa-info-circle" aria-hidden="true"></i> Click / Tap image to enlarge</p><p class="text-left pull-left"><a href="//assets.theedgemarkets.com/infogprhic-mm66-tem1259_theedgemarkets.jpg?null" target="_blank"><i class="fa fa-right fa-download" aria-hidden="true"></i> Download High Resolution</a></p></div></div></div></div></div><div class="form-item form-type-item">  <label>Language </label> Undefined</div>,2019-03-27,07:52:24,2019-03-27 22:58:10
Govt asks for RM15.5b more for development spending,http://www.theedgemarkets.com/article/govt-tables-rm155b-supplementary-budget,The Federal Government is seeking RM15.49 billion from the Consolidated Fund to supplement its development expenditure of RM46 billion for the year 2018.,2019-03-27,05:55:47,2019-03-27 22:58:10
KIP REIT, Straits Inter Logistics, Scomi Energy,http://www.theedgemarkets.com/article/kip-reit-straits-inter-logistics-scomi-energy,KUALA LUMPUR (March 27): ,2019-03-27,05:18:17,2019-03-27 22:58:10
Prosecutors ask court to bar former ISR CEO and husband from penny stock crash trial,http://www.theedgemarkets.com/article/prosecutors-ask-court-bar-former-isr-ceo-and-husband-penny-stock-crash-trial,Prosecutors at the penny stock saga trial of John Soh Chee Wen and Quah Su-Ling have asked the court to bar two individuals closely-linked to the defendants from attending the court proceedings.,2019-03-27,03:44:34,2019-03-27 22:58:10
Trump Fed nominee Moore says central bank should cut rates: NYT,http://www.theedgemarkets.com/article/trump-fed-nominee-moore-says-central-bank-should-cut-rates-nyt,(Mar 27): President Donald Trump's expected nominee for the Federal Reserve Board of Governors, Stephen Moore, said the U.S. central bank should immediately cut interest rates by half a percentage point, according to an interview with the New York Times on Tuesday.,2019-03-27,02:45:17,2019-03-27 22:58:10
AirAsia is not keen on Malaysia Airlines,http://www.theedgemarkets.com/article/airasia-not-keen-malaysia-airlines,Tan Sri Tony Fernandes, AirAsia Bhd's co-founder and group CEO, commented that the ailing Malaysia Airlines Bhd could be revived; however he is not keen on taking over the national carrier as he said his plate is full currently.,2019-03-27,02:37:05,2019-03-27 22:58:10
Red Cargo an underutilised asset in AirAsia, says Fernandes,http://www.theedgemarkets.com/article/red-cargo-underutilised-asset-airasia-says-fernandes,Low-cost carrier AirAsia Group Bhd group executive chief officer Tan Sri Tony Fernandes said its logistics arm Red Cargo was a huge asset that was underutilised.,2019-03-27,02:30:20,2019-03-27 22:58:10
Cash transaction limit in the works to curb money laundering,https://www.malaysiakini.com/news/469843,Bank Negara governor says public consultations will be held to formulate a localised policy.,2019-03-27,13:55:00,2019-03-27 22:58:10
PAC to call up chief secretary in VEP project probe,https://www.malaysiakini.com/news/469841,Ismail Bakar served as the Transport Ministry sec-gen when the project was awarded.,2019-03-27,13:35:12,2019-03-27 22:58:10
Australia, Netherlands start talks with Russia over MH17 downing,https://www.malaysiakini.com/news/469840,'We remain committed to achieving truth, justice and accountability,' says Dutch foreign minister.,2019-03-27,13:17:34,2019-03-27 22:58:10
Saifuddin to meet Dutch counterpart on downing of MH17,https://www.malaysiakini.com/news/469839,Netherlands Foreign Minister Stef Blok will be in Putrajaya for a one-day visit.,2019-03-27,13:12:00,2019-03-27 22:58:10
Ministry plans to reopen Tourism Malaysia offices in five states,https://www.malaysiakini.com/news/469835,The states are K'tan, T'ganu, Malacca, Negeri and S'gor, according to Mohamaddin Ketapi.,2019-03-27,12:30:00,2019-03-27 22:58:10
Bank Negara calls for 'critical' labour reforms with many M'sians underpaid,https://www.malaysiakini.com/news/469832,Attracting investment to generate high-skilled jobs should be gov't's focus, says Shamsiah Mohd Yunus.,2019-03-27,11:59:00,2019-03-27 22:58:11
Anwar to push for revival of Parliamentary Services Act,https://www.malaysiakini.com/news/469830,This will help strengthen the parliamentary institution, he says.,2019-03-27,11:43:42,2019-03-27 22:58:11
Anwar: Give Mahathir time to decide on PAC chief,https://www.malaysiakini.com/news/469826,A discussion needs to be held, but Mahathir is still in Langkawi.,2019-03-27,11:17:36,2019-03-27 22:58:11
Nobody stopping Anwar from becoming PM - Dr M loyalist tells Zaid to zip it,https://www.malaysiakini.com/news/469818,Khairuddin Abu Hassan also calls the former minister an irrelevant politician.,2019-03-27,10:51:00,2019-03-27 22:58:11
Malaysian economy not in deflation - Bank Negara,https://www.malaysiakini.com/news/469817,Negative headline inflation figures reported caused by lower fuel prices, it says.,2019-03-27,10:46:00,2019-03-27 22:58:11
Health Ministry open to clinical research on medical marijuana,https://www.malaysiakini.com/news/469816,PARLIAMENT | Dzulkefly says his ministry may test if the plant can be used to treat certain illnesses.,2019-03-27,10:45:00,2019-03-27 22:58:11
Disappointed with Harapan's pick, businessman to join race for Rantau,https://www.malaysiakini.com/news/469809,PKR member Hazan Khalid says he will run as an independent against 'outsider' Dr S Streram.,2019-03-27,10:26:26,2019-03-27 22:58:11
Liow grilled by PAC, defends direct negotiation in VEP project,https://www.malaysiakini.com/news/469804,Ex-transport minister clarifies that the Vehicle Entry Permit project was urgent and had to be expedited.,2019-03-27,10:11:00,2019-03-27 22:58:11
Probe completed, those involved in 'Najib talk' fracas to be charged,https://www.malaysiakini.com/news/469803,KL police chief says statements were recorded from 28 individuals over the incident.,2019-03-27,10:10:00,2019-03-27 22:58:11
Bank Negara lowers 2019 GDP forecast to 4.8 pct,https://www.malaysiakini.com/news/469798,UPDATED 10PM | Private consumption and exports expected to contract in this year due to externalities.,2019-03-27,09:50:00,2019-03-27 22:58:11
Kiandee ready to be replaced as PAC chief,https://www.malaysiakini.com/news/469797,'The PM has said that I will be replaced once a new chair is identified. So I will abide by that decision.',2019-03-27,09:34:00,2019-03-27 22:58:11
BN MP worries about sex scenes, LGBT elements on Netflix,https://www.malaysiakini.com/news/469793,PARLIAMENT | Minister Gobind Singh Deo says he will address censorship matters in writing.,2019-03-27,09:25:00,2019-03-27 22:58:11
It is not a 'flying car', clarifies firm,https://www.malaysiakini.com/news/469790,Called Vector, it is a drone-concept vehicle designed for carrying passengers, cargo and to carry out surveillance.,2019-03-27,09:14:00,2019-03-27 22:58:11
Stronger ties forged with New Zealand to combat terrorism,https://www.malaysiakini.com/news/469788,Wan Azizah says this after talks with her NZ counterpart Winston Peters.,2019-03-27,09:05:00,2019-03-27 22:58:11
Cops charged with bribery in drug case, massage parlour ops,https://www.malaysiakini.com/news/469787,A senior cop allegedly accepted RM1.35m to get rid of a trafficking case while two others were said to accept bribes from massage parlour operators.,2019-03-27,09:00:08,2019-03-27 22:58:11
No human samples found on fire truck, EMRS van: Witness,https://www.malaysiakini.com/news/469786,UPDATED 6.12PM | INQUEST | Chemistry Department officer says no blood or hair was recovered from the two vehicles.,2019-03-27,08:51:00,2019-03-27 22:58:11
Wang Kelian mass graves: Suhakam fingers cops over 'four-month delay',https://www.malaysiakini.com/news/469785,UPDATED 5.16PM | The delay could have affected evidence which could have facilitated police investigations, the commission says.,2019-03-27,08:47:00,2019-03-27 22:58:11
Violence against journos no laughing matter, Gobind tells BN MPs,https://www.malaysiakini.com/news/469784,PARLIAMENT | Minister berates opposition lawmakers for not taking the matter seriously.,2019-03-27,08:42:00,2019-03-27 22:58:12
PAC yet to receive resignation letters from opposition MPs,https://www.malaysiakini.com/news/469780,There are still enough members to meet quorum even if trio resigns, adds deputy PAC chief Wong Kah Woh.,2019-03-27,08:27:00,2019-03-27 22:58:12
