title,link,description,pubDate,pubTime,crawl_timestamp
IGP shocked SB personnel barred from Warisan's media conferences,https://www.malaysiakini.com/news/475857,'The police officers on duty there are not enemies of any party,' according to Abdul Hamid Bador.,2019-05-12,07:16:00,2019-05-12 15:55:37
India votes in penultimate phase of seven-round general election,https://www.malaysiakini.com/news/475855,Opposition seeks united stand in bid to topple PM Narendra Modi.,2019-05-12,07:14:16,2019-05-12 15:55:37
Latest Sri Lanka arrest throws spotlight on Wahhabism in eastern hotbed,https://www.malaysiakini.com/news/475852,Scholar allegedly has links with Easter Sunday bombngs ring leader.,2019-05-12,06:53:00,2019-05-12 15:55:38
Restoration of water supply in Klang at 98pct - Air S'gor,https://www.malaysiakini.com/news/475848,Spokesperson also denies claims of more water disruptions due to the three burst pipes.,2019-05-12,06:45:00,2019-05-12 15:55:38
Wan Azizah to mothers: Congratulations and thank you,https://www.malaysiakini.com/news/475847,The DPM expresses gratitude to mothers for their sacrifices.,2019-05-12,06:16:00,2019-05-12 15:55:38
Yapeim brushes off allegations RM1m from orphans' fund misused,https://www.malaysiakini.com/news/475844,Foundations says the money came from its general fund, and does not amount to RM1m.,2019-05-12,05:58:00,2019-05-12 15:55:38
Zaharudin lists five members of PAS' 'dedak cartel',https://www.malaysiakini.com/news/475843,The 'cartel' refers to those who received funds from, or who are linked to Umno.,2019-05-12,05:53:00,2019-05-12 15:55:38
Gloomy Ramadan for Utusan staff, salaries delayed,https://www.malaysiakini.com/news/475842,A company memo says it still faces 'a critical cash flow problem.',2019-05-12,05:42:00,2019-05-12 15:55:38
Notice to close eateries during Ramadan merely advice - K'tan MB,https://www.malaysiakini.com/news/475840,However, Ahmad Yakob urges people to respect prayer times.,2019-05-12,05:23:00,2019-05-12 15:55:38
Report finds Mindef land swaps also occurred during Dr M's first term,https://www.malaysiakini.com/news/475836,This despite the defence minister denying Mahathir's involvement in the problematic cases.,2019-05-12,04:56:00,2019-05-12 15:55:38
China still 'cautiously optimistic' on US trade talks despite new tariffs,https://www.malaysiakini.com/news/475828,But US Treasury secretary says no further negotiations planned 'as of now.',2019-05-12,03:47:00,2019-05-12 15:55:38
Bung claims votes were bought in Sandakan,https://www.malaysiakini.com/news/475824,Sabah Umno chief also cites a lack of funds for the failure to mobilise 9,700 party members.,2019-05-12,03:31:00,2019-05-12 15:55:38
Najib counters Kit Siang, asks how many times son has been KO-ed,https://www.malaysiakini.com/news/475823,The former PM ticks off the DAP stalwart for 'knockout blow' remarks.,2019-05-12,03:17:00,2019-05-12 15:55:38
Cuban LGBT activists defy government, hold first indie pride parade,https://www.malaysiakini.com/news/475819,More than a hundred Cubans marched nearly 1km before being stopped by authorities.,2019-05-12,02:30:00,2019-05-12 15:55:38
PKR Youth chief wants to reveal Yapeim whistleblower's identity,https://www.malaysiakini.com/news/475818,But Akmal Nasir says they must be given protection first.,2019-05-12,02:28:00,2019-05-12 15:55:38
ANC keeps power in South Africa but scandals cost it votes,https://www.malaysiakini.com/news/475817,The ruling party has secured enough seats to give President Cyril Ramaphosa another five-year term.,2019-05-12,02:14:00,2019-05-12 15:55:38
EU ambassador confident of strong ties despite palm oil dispute,https://www.malaysiakini.com/news/475816,'Our relations are about more than palm oil,' says Maria Castillo Fernandez.,2019-05-12,02:08:00,2019-05-12 15:55:38
PAS wants Hadi's son-in-law to explain 'dedak cartel' remarks,https://www.malaysiakini.com/news/475814,The party to seek further information if Zaharudin Muhammad made those remarks.,2019-05-12,01:28:00,2019-05-12 15:55:38
Takiyuddin defends calling Anwar a convict,https://www.malaysiakini.com/news/475812,Get your facts straight, the PAS leader tells those asking him to apologise.,2019-05-12,01:08:00,2019-05-12 15:55:38
Rouhani calls for unity to face 'unprecedented' US pressure,https://www.malaysiakini.com/news/475809,The call comes amidst American military build-up in the Gulf region.,2019-05-12,00:57:00,2019-05-12 15:55:38
Gunmen storm five-star hotel in Pakistan, killing at least one,https://www.malaysiakini.com/news/475808,Military says militants cornered in hotel staircase.,2019-05-12,00:33:00,2019-05-12 15:55:38
Yoursay: Can Dr M free himself from race-and-religion straitjacket?,https://www.malaysiakini.com/news/475806,YOURSAY | 'Mahathir, affirmative action should be based on needs, and not on race.',2019-05-11,23:41:00,2019-05-12 15:55:38
The post-GE14 electoral reform journey,https://www.malaysiakini.com/news/475805,COMMENT | Measures to overhaul M'sian election system have been heartening, but challenges remain.,2019-05-11,23:31:00,2019-05-12 15:55:39
DAP retains Sandakan, and 5 things that happened yesterday,https://www.malaysiakini.com/news/475803,KINI ROUNDUP | Key headlines you may have missed yesterday, in brief.,2019-05-11,23:03:00,2019-05-12 15:55:39
EC calls Sandakan polls a 'model of a good election',https://www.malaysiakini.com/news/475831,SANDAKAN POLLS | Azhar says this is the best by-election under his watch, despite the low turnout.,2019-05-11,15:04:00,2019-05-12 15:55:39
Anwar cautions Harapan against resting on Sandakan laurels,https://www.malaysiakini.com/news/475800,SANDAKAN POLLS | He says the coalition must continue to work hard to ensure the people's economic well-being.&nbsp;,2019-05-11,14:40:00,2019-05-12 15:55:39
Anwar: Emphasise education over grand houses of worship,https://www.malaysiakini.com/news/475798,He says the country cannot have grand mosques and temples at the expense of education.,2019-05-11,14:23:00,2019-05-12 15:55:39
China announces tariff retaliation to take effect on June 1,http://www.theedgemarkets.com/article/china-announces-tariff-retaliation-take-effect-june-1,China announced that it will increase tariffs imposed on about US$60 billion of U.S. goods in retaliation for President Donald Trump's latest escalation of the trade war.,2019-05-13,14:07:08,2019-05-13 23:03:31
An 'unfair but reasonable' offer for Yee Lee minorities? ,http://www.theedgemarkets.com/article/unfair-reasonable-offer-yee-lee-minorities,YEE Lee Corp Bhd is the privatisation target of private equity fund Dymon Asia Private Equity (S.E. Asia) Fund II Ptd Ltd, which has been on the prowl for undervalued public-listed assets in the region.,2019-05-13,13:50:00,2019-05-13 23:03:31
DRB-HICOM confirms MACC's remand of subsidiary's top execs in defence contract probe,http://www.theedgemarkets.com/article/drbhicom-confirms-maccs-remand-subsidiarys-top-execs-defence-contract-probe,DRB-HICOM Bhd confirmed today that the Malaysian Anti-Corruption Commission (MACC) has remanded two top executives of its wholly-owned subsidiary DRB-HICOM Bhd Defence Technologies Sdn Bhd (Deftech), in connection with a graft probe on an RM17 million defence contract.,2019-05-13,12:52:04,2019-05-13 23:03:32
SGX restrictions could have caused 2013 penny stocks crash, says Lim & Tan director,http://www.theedgemarkets.com/article/sgx-restrictions-could-have-caused-2013-penny-stocks-crash-says-lim-tan-director,Esther Seet, executive director of brokerage firm Lim & Tan Securities, reckoned "on hindsight" restrictions imposed by the Singapore Exchange on stocks of Blumont Group, Asiasons Capital (now known as Attilan Group) and LionGold Corp (BAL) could have caused the 2013 penny stocks crash.,2019-05-13,10:57:15,2019-05-13 23:03:32
Go long on US dollar-ringgit, says Morgan Stanley Research,http://www.theedgemarkets.com/article/go-long-us-dollarringgit-says-morgan-stanley-research,Morgan Stanley Research has recommended forex traders to go long in the US dollar-Malaysian ringgit, as it forecasts the ringgit to be weaker against the greenback compared with current levels for the whole of 2019.,2019-05-13,10:25:06,2019-05-13 23:03:32
Court wants Semantan Estates' bid to compel govt to return Jalan Duta land be heard,http://www.theedgemarkets.com/article/semantan-estates-gets-leave-try-retaining-beneficial-interests-26327acre-land,Semantan Estates (1952) Sdn Bhd has been granted leave by the High Court here to initiate a hearing of the merits of its claims to retain beneficial interests and cause to transfer ownership in a 263.67-acre piece of land along the former Jalan Duta (now Jalan Tuanku Abdul Halim) that currently houses a number of government complexes and facilities.,2019-05-13,10:24:06,2019-05-13 23:03:32
KLCI cuts losses after slumping below 1,600 points as trade tension hurts sentiment,http://www.theedgemarkets.com/article/klci-cuts-losses-after-slumping-below-1600-points-trade-tension-hurts-sentiment,The FBM KLCI closed 9.18 points or 0.57% lower today at 1,601.09 after slumping below 1,600 as the China-US trade war escalation hurt world market sentiments.,2019-05-13,10:02:39,2019-05-13 23:03:32
China says will 'never surrender' as US trade row heats up,http://www.theedgemarkets.com/article/china-says-will-never-surrender-us-trade-row-heats,China will never surrender to external pressure, the government said on Monday, though stopped short of announcing how Beijing will hit back after Washington renewed its threat to impose tariffs on all Chinese imports in an escalating trade dispute.,2019-05-13,09:01:08,2019-05-13 23:03:32
Thailand's richest man, 12 others to build US$6.8b high-speed rail,http://www.theedgemarkets.com/article/thailands-richest-man-12-others-build-us68b-highspeed-rail,Thai conglomerate Charoen Pokphand Group (CP) and 12 other companies were selected to build a US$6.8 billion high-speed train project that will link three major airports in the country, the government said on Monday.,2019-05-13,08:47:40,2019-05-13 23:03:32
Maybank: Plantation firms' 1Q earnings pressure seen,http://www.theedgemarkets.com/article/maybank-plantation-firms-1q-earnings-pressure-seen,Maybank IB Research said the plantation sector could have seen continued earnings pressure in the first quarter of 2019 (Q1 2019), mainly on weak spot crude palm oil (CPO) average selling price (ASP).,2019-05-13,08:41:12,2019-05-13 23:03:32
AirAsia, Petronas Chemicals added to FTSE Value-Stocks Asean Index,http://www.theedgemarkets.com/article/airasia-petronas-chemicals-added-ftse-valuestocks-asean-index,Two Malaysian stocks, AirAsia Group Bhd and Petronas Chemicals Group Bhd, are among latest additions to FTSE Russell's  FTSE Value-Stocks Asean Index.  ,2019-05-13,08:30:05,2019-05-13 23:03:32
Morgan Stanley cuts Malaysia's 2019 GDP forecast to 4.5%,http://www.theedgemarkets.com/article/morgan-stanley-cuts-malaysias-2019-gdp-forecast-45,Morgan Stanley has cut Malaysia's 2019 gross domestic product (GDP) growth forecast to 4.5% from 4.6%, as it takes into account the downside risks presented with renewed escalation in the US-China trade tension.,2019-05-13,07:53:28,2019-05-13 23:03:32
Trump says the U.S. is 'right where we want to be with China',http://www.theedgemarkets.com/article/trump-says-us-right-where-we-want-be-china,WASHINGTON (May 13): President Donald Trump said on Sunday that the United States is "right where we want to be with China," adding that Beijing "broke the deal with us" and then sought to renegotiate.,2019-05-13,07:44:06,2019-05-13 23:03:32
SoftBank's Vision Fund invests $800 million in Britain's Greensill,http://www.theedgemarkets.com/article/softbanks-vision-fund-invests-800-million-britains-greensill,(May 13): Financing group Greensill Capital on Monday confirmed SoftBank Group Corp's Vision Fund has invested $800 million in the British company, a vote of confidence in the UK finance sector that has been navigating Brexit challenges.,2019-05-13,07:39:54,2019-05-13 23:03:32
Malaysia bubble tea chain said to seek US$72m IPO next year,http://www.theedgemarkets.com/article/malaysia-bubble-tea-chain-said-seek-us72m-ipo-next-year,Loob Holding Sdn Bhd, which owns the Tealive bubble tea brand, is planning a Malaysian initial public offering that could raise as much as RM300 million (US$72 million), according to people with knowledge of the matter.,2019-05-13,06:38:30,2019-05-13 23:03:33
Cuepacs still receives complaints of political interference post-GE14,https://www.malaysiakini.com/news/476016,Azih Muda says these complaints involve civil servants who are given political appointments.,2019-05-13,14:51:17,2019-05-13 23:03:33
Hadi denies blessing son-in-law's 'dedak cartel' revelation,https://www.malaysiakini.com/news/476012,PAS&nbsp;president says he had been unaware of the allegations revealed by&nbsp;Zaharudin Muhammad.&nbsp;,2019-05-13,13:38:57,2019-05-13 23:03:33
Maszlee to head TVET empowerment committee, says Kula,https://www.malaysiakini.com/news/476010,'Our aim is to review TVET-related issues thoroughly,' says human resources minister.&nbsp;,2019-05-13,12:54:14,2019-05-13 23:03:33
Even auditor general does not question CMI, Guan Eng testifies,https://www.malaysiakini.com/news/476006,Former Penang CM says there is nothing wrong in establishing the Chief Minister Incorporated.&nbsp;,2019-05-13,11:58:02,2019-05-13 23:03:33
'Datuk' CEO, CFO remanded for alleged graft in defence contract,https://www.malaysiakini.com/news/476003,The is over an RM17 million contract to supply equipment for armoured combat vehicles.,2019-05-13,11:20:00,2019-05-13 23:03:33
Recap 1: What we've learned from Najib's SRC trial so far,https://www.malaysiakini.com/news/476001,KINIGUIDE | This article will attempt to answer some common questions about the trial.,2019-05-13,11:03:00,2019-05-13 23:03:33
Rafizi to use refund from NFC trial for bright students,https://www.malaysiakini.com/news/475994,Putrajaya High Court today orders NFC executive chairperson Mohamad Salleh Ismail to refund RM300k.,2019-05-13,10:11:00,2019-05-13 23:03:33
Harapan pressed to tackle youth unemployment in its second year,https://www.malaysiakini.com/news/475991,M'sian Youth Council also calls for a hike in the minimum wage and increased internet access in rural areas.,2019-05-13,09:41:49,2019-05-13 23:03:33
MB: Selangor to double efforts to keep the people's trust,https://www.malaysiakini.com/news/475990,Amirudin Shari aims to make the state a model for the rest of the country.,2019-05-13,09:28:00,2019-05-13 23:03:33
Cops urged to probe Takiyuddin's statement on Anwar's royal pardon,https://www.malaysiakini.com/news/475989,Kelantan PKR Youth says the PAS sec-gen should not call the Agong's decision into question.,2019-05-13,09:15:43,2019-05-13 23:03:33
Ex-deputy minister denies involvement in Yapeim scandals,https://www.malaysiakini.com/news/475987,Asyraf Wajdi Dusuki says he was not involved in managing the foundation, nor did he accept rewards.&nbsp;,2019-05-13,09:14:00,2019-05-13 23:03:33
Minister targets year-end for tabling of food bank bill,https://www.malaysiakini.com/news/475986,According to Saifuddin Nasution Ismail, this will ensure more systematic implementation.,2019-05-13,09:07:24,2019-05-13 23:03:33
Historic Sandakan polls quashes myth of 'Bossku' invincibility,https://www.malaysiakini.com/news/475980,MP SPEAKS | It also pulverises myth that Harapan gov't is a one-term administration.&nbsp;,2019-05-13,08:29:00,2019-05-13 23:03:33
Felda DG: We can't just clock in and out, uplifting poor requires 'jihad',https://www.malaysiakini.com/news/475979,Othman Omar stresses that employees of the agency need to have the right attitude.,2019-05-13,08:21:00,2019-05-13 23:03:33
Gerakan urges gov't to abolish matriculation,https://www.malaysiakini.com/news/475974,Dominic Lau thinks Harapan should have the courage to do what is 'politically correct'.,2019-05-13,07:59:00,2019-05-13 23:03:33
National implications of the Sandakan by-election,https://www.malaysiakini.com/news/475968,MP SPEAKS | Can Harapan's 'winning formula' be applied to the rest of Malaysia?,2019-05-13,07:37:00,2019-05-13 23:03:34
'Razak Baginda told me he didn't ask Azilah to kill Altantuya',https://www.malaysiakini.com/news/475967,Siti Aisyah, secretary to political analyst Abdul Razak Baginda, recalls her meeting with the latter.,2019-05-13,07:35:00,2019-05-13 23:03:34
Daim laments the return of racism,https://www.malaysiakini.com/news/475966,Look towards the future, instead of dwelling on the past, the special adviser to the gov't says.,2019-05-13,07:24:00,2019-05-13 23:03:34
Cops foil terrorist plot to attack non-Muslim houses of worship,https://www.malaysiakini.com/news/475963,UPDATED 4.14PM | Cell linked to Islamic State also planned to kill high-profile individuals, adds IGP Abdul Hamid Bador.,2019-05-13,07:07:00,2019-05-13 23:03:34
Home minister says IPCMC bill to be tabled this year,https://www.malaysiakini.com/news/475962,UPDATED 4.50PM | Muhyiddin states this will allow the commission to be set up by the end of 2019.,2019-05-13,07:05:00,2019-05-13 23:03:34
Zaharudin: T'ganu MB, Hadi's son not part of 'dedak cartel',https://www.malaysiakini.com/news/475961,Hadi's son-in-law refutes speculations these two are among the unnamed five he said took money from Umno.,2019-05-13,06:38:11,2019-05-13 23:03:34
Muhyiddin: No official request to declassify May 13 documents,https://www.malaysiakini.com/news/475958,Home minister also stresses that Harapan is focused on the present and future, not the past.,2019-05-13,06:22:00,2019-05-13 23:03:34
Penang civil servants to get special Hari Raya bonus,https://www.malaysiakini.com/news/475955,All the state civil servants will get minimum RM1,000.,2019-05-13,06:07:28,2019-05-13 23:03:34
Rafizi wins appeal in NFCorp defamation case,https://www.malaysiakini.com/news/475956,Court of Appeal rules there is merit to the PKR vice-president's appeal.,2019-05-13,06:07:00,2019-05-13 23:03:34
Argentina seeks JV with M'sia on renewable, nuclear energy,https://www.malaysiakini.com/news/475954,'There are a lot of things we can do together because we have the same vision,' says VP Gabriela Michetti.,2019-05-13,06:01:00,2019-05-13 23:03:34
With DAP in silent mode, there's need for Third Force,https://www.malaysiakini.com/news/475951,COMMENT | We need brave professionals to continue momentum of change.,2019-05-13,05:50:00,2019-05-13 23:03:34
Sri Lanka imposes new curfew as mosques attacked,https://www.malaysiakini.com/news/475948,UPDATED 8.15PM | It also blocks Facebook and WhatsApp to stop people from inciting violence.,2019-05-13,05:42:00,2019-05-13 23:03:34
Tabung Haji posts Q1 2019 net profit of RM440 million,https://www.malaysiakini.com/news/475949,Its stronger financial position comes with the successful completion of its restructuring and rehabilitation process.,2019-05-13,05:42:00,2019-05-13 23:03:34
Barring cops from party events against the law, IGP tells Warisan,https://www.malaysiakini.com/news/475947,UPDATED 3.30PM | Abdul Hamid Bador responds to the party stopping SB from attending its press conferences.,2019-05-13,05:41:00,2019-05-13 23:03:34
CCID chief Mazlan Mansor appointed as deputy IGP,https://www.malaysiakini.com/news/475936,UPDATED 3.08PM | His appointment fills the vacancy left by the retired&nbsp;Noor Rashid Ibrahim.,2019-05-13,04:49:00,2019-05-13 23:03:34
AirAsia takes legal action against Mavcom,http://www.theedgemarkets.com/article/airasia-takes-legal-action-against-mavcom,AirAsia Bhd and AirAsia X Bhd have filed a judicial review challenging the Malaysian Aviation Commission (Mavcom) for declining to decide on the disputes between Malaysia Airport (Sepang) Sdn Bhd (MASSB) and the airlines, pertaining to uncollected passenger service charges (PSC) and alleged poor level of service at klia2.,2019-05-14,10:43:41,2019-05-14 20:53:09
China says agreed with U.S. to keep talking over trade war,http://www.theedgemarkets.com/article/china-says-agreed-us-keep-talking-over-trade-war,BEIJING/WASHINGTON (May 14): China and the United States have agreed to keep talking about their trade dispute, the Chinese government said on Tuesday, as U.S. President Donald Trump said he thought recent discussions in Beijing would be successful.,2019-05-14,10:42:16,2019-05-14 20:53:09
KLCI ends with mild drop after rebounding 27 points from day's low at 1,572.03,http://www.theedgemarkets.com/article/klci-ends-mild-drop-after-rebounding-27-points-days-low-157203,The FBM KLCI erased 11th-hour gains today to close 1.9 points or 0.12% lower as investors evaluated the impact of the China-US trade tension on world markets.,2019-05-14,10:38:29,2019-05-14 20:53:10
Fed's Williams says policymakers need to better prepare for lower interest rate world,http://www.theedgemarkets.com/article/feds-williams-says-policymakers-need-better-prepare-lower-interest-rate-world,(May 14): Torturously slow recoveries from recessions and low inflation are here to stay unless policymakers can get a better grip on how to stabilize the global economy in an era of lower interest rates, a top Federal Reserve policymaker said on Tuesday.,2019-05-14,10:32:12,2019-05-14 20:53:11
Mindef land swaps: Nobody above the law -- Dr Mahathir,http://www.theedgemarkets.com/article/mindef-land-swaps-nobody-above-law-%E2%80%94-dr-mahathir,Prime Minister Tun Dr Mahathir Mohamad today said the police will investigate anyone, even the prime minister, over any involvement in the Defence Ministry's (Mindef) land-swap deals.,2019-05-14,08:55:56,2019-05-14 20:53:11
Top Glove, Hartalega gain as ringgit weakens,http://www.theedgemarkets.com/article/top-glove-hartalega-gain-ringgit-weakens,Top Glove Corp Bhd shares rose as much as 13 sen or 2.78% so far today, while Hartalega Holdings Bhd climbed 19 sen or 3.93% to its intraday high on bargain hunting and as the ringgit weakened against the US dollar.,2019-05-14,08:32:19,2019-05-14 20:53:11
Ministers may soon add anti-corruption measures to their KPIs,http://www.theedgemarkets.com/article/dr-mahathir-wants-lawmakers-declare-assets-antigraft-drive,Ministers may soon be required to include safeguards against corruption within their ministries as part of their key performance indicators (KPIs).,2019-05-14,06:57:15,2019-05-14 20:53:11
KWAP's meeting minutes did not indicate it was forced to approve loans to SRC, court told,http://www.theedgemarkets.com/article/kwaps-meeting-minutes-did-not-indicate-it-was-forced-approve-loans-src-court-told,Witness Azlida Mazni Arshad has affirmed that the minutes of meeting of Kumpulan Wang Persaraan (Diperbadankan) (KWAP) never indicated that it was forced to approve loans to 1Malaysia Development Bhd's former subsidiary SRC International Sdn Bhd.,2019-05-14,06:53:12,2019-05-14 20:53:12
Members only: U.S. retailers revamp loyalty schemes for Amazon era,http://www.theedgemarkets.com/article/members-only-us-retailers-revamp-loyalty-schemes-amazon-era,(May 14): With private fitting rooms, members-only stores and clever apps, U.S. department stores are reinventing their old and tested loyalty programs to fend off the challenge from e-commerce giant Amazon.com Inc and other online rivals.,2019-05-14,06:05:52,2019-05-14 20:53:12
Digi sees flat growth in service revenue for FY19,http://www.theedgemarkets.com/article/digi-sees-flat-growth-service-revenue-fy19,Digi.Com Bhd is expecting a flat growth in its service revenue for the financial year ending Dec 31, 2019 (FY19), amid the challenging market environment.,2019-05-14,05:53:00,2019-05-14 20:53:12
Tesla car catches fire in Hong Kong parking lot: media,http://www.theedgemarkets.com/article/tesla-car-catches-fire-hong-kong-parking-lot-media,HONG KONG (May 14): A Tesla Inc electric car caught fire in a parking lot in a Hong Kong shopping mall, the Apple Daily newspaper said on Tuesday, but no one was injured in the blaze, whose cause was not immediately known.,2019-05-14,05:39:01,2019-05-14 20:53:13
China stocks stumble on tariff escalation, state buying seen,http://www.theedgemarkets.com/article/china-stocks-stumble-tariff-escalation-state-buying-seen,HONG KONG/SHANGHAI (May 14): Chinese stocks fell on Tuesday as the tariff war between Washington and Beijing escalated though losses were contained after conciliatory comments from U.S. President Donald Trump and amid suspected state-backed buying of equities.,2019-05-14,05:23:01,2019-05-14 20:53:13
MyNews, SCIB ,http://www.theedgemarkets.com/article/mynews-scib,KUALA LUMPUR (May 14): ,2019-05-14,05:10:55,2019-05-14 20:53:13
Tealive operator to increase hiring as more outlets open,http://www.theedgemarkets.com/article/tealive-operator-increase-hiring-more-outlets-open,Loob Holding Sdn Bhd, the company behind popular food and beverage (F&B) brands including Tealive, Ko Ko Kai, Gindaco and Define Food, is planning to hire 1,200 to 1,500 more workers over the next two years as it embarks on an aggressive expansion programme for its brands.,2019-05-14,05:02:19,2019-05-14 20:53:14
Shafee fails in bid to get his passport to attend Aussie case,http://www.theedgemarkets.com/article/shafee-fails-bid-get-his-passport-attend-aussie-case,Lawyer Tan Sri Muhammad Shafee Abdullah today failed to get his passport returned temporarily in order for him to be present in an Australia court to assist in a drug case involving a Malaysian.,2019-05-14,04:47:11,2019-05-14 20:53:14
There would be two deaths if Adib pulled from van, inquest told,https://www.malaysiakini.com/news/476134,ADIB INQUEST | HKL forensic expert says this is because any perpetrator would also be in the danger zone.,2019-05-14,12:10:01,2019-05-14 20:53:14
Don't sweep 'dedak cartel' under the carpet, PAS warned,https://www.malaysiakini.com/news/476133,Zaharudin welcomes the party's gag order, but says he will fight if the case is buried.,2019-05-14,11:35:00,2019-05-14 20:53:14
