title,link,description,pubDate,pubTime,crawl_timestamp
Muhyiddin hints ex-Umno rep may lead Sabah Bersatu,https://www.malaysiakini.com/news/471170,UPDATED 6.55PM | Hajiji Noor, who defected to Bersatu recently, among key position holders, says the party president.,2019-04-06,10:18:00,2019-04-07 08:04:19
Thailand's rising political star charged with sedition,https://www.malaysiakini.com/news/471168,The sedition charge, which was filed by the junta, was the second case opened against Thanathorn.,2019-04-06,10:04:00,2019-04-07 08:04:19
Waythamoorthy buoyed by Padang Meha compensation decision,https://www.malaysiakini.com/news/471166,The judgement awarded to displaced workers after 23-year battle could be precedent-setting, he says.,2019-04-06,09:59:32,2019-04-07 08:04:19
Najib: Time for people to question Harapan's broken promises,https://www.malaysiakini.com/news/471165,Ex-premier slams current government, saying it lacks moral legitimacy.,2019-04-06,09:54:00,2019-04-07 08:04:19
Family claims MIC exploited senior citizen by making him wear Bossku T-shirt,https://www.malaysiakini.com/news/471164,RANTAU POLLS | In a recording, MIC deputy president M Saravanan is seen asking the 60-year-old to change.,2019-04-06,09:51:00,2019-04-07 08:04:20
PAS welcomes Malaysia's withdrawal from Rome Statute,https://www.malaysiakini.com/news/471162,We welcome anything that benefits Islam, says its spiritual leader Hashim Jasin.,2019-04-06,09:34:00,2019-04-07 08:04:20
Rome Statute withdrawal a regressive move, decries Kit Siang,https://www.malaysiakini.com/news/471160,The DAP veteran says people should be more knowledgeable about this issue.,2019-04-06,09:15:00,2019-04-07 08:04:20
Gov't to address foreigners' ID documentation, stateless children issues in Sabah,https://www.malaysiakini.com/news/471156,Restructuring of departments will be carried out to achieve this, says the home minister.,2019-04-06,08:58:00,2019-04-07 08:04:20
Abang Johari: Sabah, S'wak CMs did not give approval for amendment of Article 1(2),https://www.malaysiakini.com/news/471155,S'wak CM Abang Johari the MA63 committee never discussed the actual wordings in its meetings.,2019-04-06,08:52:00,2019-04-07 08:04:21
Enforced disappearance: Rights group threatens to sue IGP, gov't,https://www.malaysiakini.com/news/471151,However, families of Raymond Koh and Amri Che Mat say the group does not represent them.,2019-04-06,08:34:15,2019-04-07 08:04:21
Law minister orders legal assistance to France, Switzerland, Luxembourg,https://www.malaysiakini.com/news/471143,The investigations concern an assortment of graft and white-collar crimes, but no further details are available.,2019-04-06,07:34:00,2019-04-07 08:04:21
Acting DIGP confident IGP Fuzi will answer 'enforced disapperance' claims,https://www.malaysiakini.com/news/471139,Abdul Hamid Bador says Suhakam's findings on Raymond Koh's and Amri Che Mat's disappearances has badly affected the police force. ,2019-04-06,07:02:00,2019-04-07 08:04:21
'Because of a person who wants to be free to beat up people' - read Mahathir's transcript,https://www.malaysiakini.com/news/471137,Read the full transcript of yesterday's press conference explaining M'sia's shocking withdrawal from the Rome Statute.,2019-04-06,06:56:00,2019-04-07 08:04:22
Kelantan crown prince to tie the knot with Swedish bride on April 19,https://www.malaysiakini.com/news/471131,The prince orders gifts meant for the occasion to be channelled to welfare organisations instead.,2019-04-06,05:47:00,2019-04-07 08:04:22
Mat Hasan lauds Guan Eng's teaser for ECRL reroute to N9,https://www.malaysiakini.com/news/471130,RANTAU POLLS | This makes a lot of sense as land in Negeri Sembilan is cheaper, but the state must benefit by having an ECRL station built there.,2019-04-06,05:28:00,2019-04-07 08:04:22
Inspired by caricature mocking Najib, NGO 'makes clowns' of Harapan ministers,https://www.malaysiakini.com/news/471127,Guan Eng, Maszlee, Teresa and Mujahid receive similar red-nose touch-ups.,2019-04-06,05:13:00,2019-04-07 08:04:23
M'sia, S'pore reach agreement to end airspace standoff,https://www.malaysiakini.com/news/471126,Island republic withdraws procedures for Seletar Airport while Malaysia lifts restrictions over Pasir Gudang.,2019-04-06,05:03:00,2019-04-07 08:04:23
MA63 amendments a big step by Harapan - opponents have vested interests,https://www.malaysiakini.com/news/471125,ADUN SPEAKS | The Federal gov't is sincere over status of Sabah and Sarawak, but GPS state gov't playing a sly waiting game.,2019-04-06,04:47:00,2019-04-07 08:04:24
'Don't vote Keling' banner in Rantau - Mat Hasan denies it's BN,https://www.malaysiakini.com/news/471119,UPDATED 3PM&nbsp;| RANTAU POLLS | Banners urge voters not to support an Indian candidate and vote for BN instead, ex-MB claims it's reverse psychology.,2019-04-06,03:46:00,2019-04-07 08:04:24
How excess speed, hasty commands, and flawed software doomed an Ethiopian Airlines 737 MAX,https://www.malaysiakini.com/news/471117,A damaged sensor was feeding faulty data to a stall-prevention system, and excess speed made it difficult for pilots to regain control. ,2019-04-06,03:15:22,2019-04-07 08:04:24
More and more businesses cut ties with Brunei over gay sex death penalty,https://www.malaysiakini.com/news/471116,Borneo nation experiencing further backlash over its move towards harsher laws; Oxford students want Sultan's honorary degree rescinded.,2019-04-06,03:09:00,2019-04-07 08:04:24
International chorus condemning Rome Statute pullout,https://www.malaysiakini.com/news/471112,'The ICC is the only avenue for justice for the millions of victims of international crimes.',2019-04-06,02:34:00,2019-04-07 08:04:24
Yoursay: Mat Hasan insulting Rantau folk by feeding them fiction,https://www.malaysiakini.com/news/471107,YOURSAY | 'He dares to publicly and glaringly twist the facts without so much as batting an eyelid.',2019-04-06,01:02:00,2019-04-07 08:04:24
Is Sunway REIT's proposed RM10b perpetual notes a poison chalice to unitholders?,http://www.theedgemarkets.com/article/sunway-reits-proposed-rm10b-perpetual-notes-poison-chalice-unitholders, ,2019-04-06,01:24:44,2019-04-07 21:20:09
This is how the Fortis deal will benefit IHH -- and it goes beyond India,http://www.theedgemarkets.com/article/what-does-ihh-see-fortis,KUALA LUMPUR (April 6): IHH Healthcare Bhd recently completed its protracted acquisition of a 31.17% stake in Fortis Healthcare Ltd, thus expanding its footprint in India.,2019-04-06,01:00:12,2019-04-07 21:20:09
Guan Eng hints that the ECRL could be rerouted to Negri Sembilan,http://www.theedgemarkets.com/article/guan-eng-hints-ecrl-could-be-rerouted-negri-sembilan,Finance Minister Lim Guan Eng hinted that  the East Coast Railway Line (ECRL) may be rerouted to Negri Sembilan during a ceramah for the Rantau State seat by-election tonight.,2019-04-05,17:19:47,2019-04-07 21:20:09
Singapore-Malaysia Leaders' Retreat next week to discuss unresolved issues,http://www.theedgemarkets.com/article/singaporemalaysia-leaders-retreat-next-week-discuss-unresolved-issues,Malaysia and Singapore will discuss the unresolved bilateral issues during the ninth Singapore-Malaysia Leaders' Retreat, scheduled from April 8-9 in a friendly manner, said Prime Minister Tun Dr Mahathir Mohamad.,2019-04-05,15:01:32,2019-04-07 21:20:09
Berjaya Assets, Boustead, Sime Darby Property, Icon Offshore, Orion IXL, Kian Joo and Can-One,http://www.theedgemarkets.com/article/berjaya-assets-boustead-sime-darby-property-icon-offshore-orion-ixl-kian-joo-and-canone,Based on corporate announcements and news flow today, companies in focus on Monday (April 8) may include: Berjaya Assets Bhd, Boustead Holdings Bhd, Sime Darby Property Bhd, Icon Offshore Bhd, Orion IXL Bhd, Kian Joo Can Factory Bhd and Can-One Bhd,2019-04-05,14:42:03,2019-04-07 21:20:09
PM: Where can Lynas send its wastes that no one wants to?,http://www.theedgemarkets.com/article/pm-where-can-lynas-send-its-wastes-no-one-wants,While Prime Minister Tun Dr Mahathir Mohamad acknowledged that the new Government has imposed a precondition for Lynas Corp Ltd to ship out its wastes, he noted the reality that the Australia-based rare-earth processor may have problems finding a destination which would accept the radioactive water leached purification (WLP) solid wastes residue.,2019-04-05,11:14:10,2019-04-07 21:20:09
Boustead confirms Amrin's appointment as new MD,http://www.theedgemarkets.com/article/boustead-confirms-amrins-appointment-new-md,Boustead Holdings Bhd has appointed former Sime Darby Property Bhd CEO Datuk Seri Amrin Awaluddin as its new managing director, confirming a report in ,2019-04-05,11:09:11,2019-04-07 21:20:09
Tabung Haji announces hibah of 1.25 percent for 2018,http://www.theedgemarkets.com/article/tabung-haji-announces-hibah-125-percent-2018,Lembaga Tabung Haji (TH) today announced a hibah (dividend) of 1.25 percent, which amounts to a payout of RM913 million to its depositors for the 2018 financial year.,2019-04-05,10:54:39,2019-04-07 21:20:09
FBM KLCI 0.2% lower on foreign selling,http://www.theedgemarkets.com/article/fbm-klci-02-lower-foreign-selling,The FBM KLCI ended down 3.26 points or 0.2% today at 1,641.81 on foreign selling.,2019-04-05,10:19:24,2019-04-07 21:20:09
MoF: No change in RON95, RON97, diesel prices,http://www.theedgemarkets.com/article/mof-no-change-ron97-ron95-diesel-prices,The Finance Ministry (MoF) said today retail prices for RON97 and RON95 petrol remain at RM2.63 and RM2.08 per litre respectively for the April 6 to 12 period based on the government's weekly petroleum products price setting using the automatic pricing mechanism (APM) formula.,2019-04-05,09:30:53,2019-04-07 21:20:09
Hearing of Najib's 1MDB case to start on May 14,http://www.theedgemarkets.com/article/hearing-najibs-1mdb-case-start-may-14-0,The High Court today fixed 14 days of hearing beginning May 14 for Datuk Seri Najib Razak's 1Malaysia Development Bhd (1MDB) case, involving RM2.28 billion. ,2019-04-05,09:28:01,2019-04-07 21:20:09
MOF subsidiary Suria Strategic fined RM18m for infringing BNM conditions on pipeline projects,http://www.theedgemarkets.com/article/mof-subsidiary-suria-strategic-fined-rm18m-infringing-bnm-conditions-pipeline-projects,Suria Strategic Energy Resources Sdn Bhd (SSER), a subsidiary of the Ministry of Finance which carried out two petrochemical and gas pipeline projects worth RM9.4 billion was today fined RM18 million by the Sessions Court here today for failing to comply with Bank Negara Malaysia (BNM) conditions.,2019-04-05,08:46:33,2019-04-07 21:20:09
PM: Malaysia to withdraw from Rome Statute over politicising of ratification,http://www.theedgemarkets.com/article/pm-malaysia-withdraw-rome-statute-over-politicising-ratification,The Cabinet has decided that Malaysia will withdraw from ratifying the Rome Statute that covers crimes against humanity and other serious infractions over heavy politicisation of its ratification, Prime Minister Tun Dr Mahathir Mohamad announced today.,2019-04-05,08:23:57,2019-04-07 21:20:09
Rosmah unfit to attend court today, case moved to April 23,http://www.theedgemarkets.com/article/rosmah-unfit-attend-court-today-case-moved-april-23,Datin Seri Rosmah Mansor, who is facing two counts of receiving bribes in connection with implementation of the solar hybrid system project for rural schools in Sarawak, is unfit to attend court proceedings, the High Court was told today.,2019-04-05,07:30:36,2019-04-07 21:20:09
OPR cut unlikely to cause domestic market volatility -- MARC,http://www.theedgemarkets.com/article/opr-cut-unlikely-cause-domestic-market-volatility-%E2%80%94-marc,A cut on the overnight policy rate (OPR) is unlikely to stoke significant domestic financial market volatility, opines Malaysian Rating Corp Bhd (MARC).,2019-04-05,07:16:50,2019-04-07 21:20:10
Dr M reacts more fiercely when challenged - Mukhriz,https://www.malaysiakini.com/news/471285,Kedah MB says this&nbsp;in reference to attacks on Mahathir's government over the Rome Statute.,2019-04-07,13:07:55,2019-04-07 21:20:10
PTPTN: RM56b allocated for over three million students as of Feb,https://www.malaysiakini.com/news/471283,Wan Saiful says gov't will continue to make PTPTN as the ultimate financial provider to benefit future generations.,2019-04-07,12:51:06,2019-04-07 21:20:10
Large following in Sabah not a threat to Warisan - Bersatu sec-gen,https://www.malaysiakini.com/news/471280,Marzuki Yahya says this will only strengthen Harapan at the federal level.,2019-04-07,12:33:57,2019-04-07 21:20:10
Anwar: Some trumpet Umno-PAS unity but quietly seek 'insurance' from me,https://www.malaysiakini.com/news/471278,RANTAU POLLS | Mat Hasan will not officially take over as Umno president, he adds.,2019-04-07,11:54:54,2019-04-07 21:20:10
Thai cops nab M'sian with 64kg cannabis in Songkhla,https://www.malaysiakini.com/news/471277,Police say the man&nbsp;planned to smuggle the drugs into Penang.,2019-04-07,11:26:06,2019-04-07 21:20:10
Rome Statute: Johor sultan thanks Putrajaya for listening to people's voice,https://www.malaysiakini.com/news/471271,Sultan Ibrahim says he will continue to defend the country's sovereignty and harmony of its people.,2019-04-07,10:49:00,2019-04-07 21:20:10
Anwar appreciative of Dr M's vote of confidence,https://www.malaysiakini.com/news/471266,This after the PM praised his designated successor's leadership qualities in an interview.,2019-04-07,09:32:00,2019-04-07 21:20:10
Aide: Johor MB's KL trip 'normal', don't believe in rumours,https://www.malaysiakini.com/news/471264,Press sec says Osman Sapian will be attending the 9th S'pore-M'sia Leaders' Retreat on Tuesday.&nbsp;,2019-04-07,09:12:00,2019-04-07 21:20:10
Pakistan says India preparing another attack this month,https://www.malaysiakini.com/news/471262,According to Foreign Minister Shah Mahmood Qureshi, this could take place between April 16 and 20.,2019-04-07,09:06:00,2019-04-07 21:20:10
Sabah's rural road network gets RM316.9m boost,https://www.malaysiakini.com/news/471257,Rina Harun says three of the 81 planned projects in the state have been completed.,2019-04-07,08:31:00,2019-04-07 21:20:10
ECRL contract in line with PWD standards, Najib tells Dr M,https://www.malaysiakini.com/news/471250,Ex-PM challenges Putrajaya to reveal the document if the reverse is true.,2019-04-07,07:51:00,2019-04-07 21:20:10
Businessperson in Penang tunnel case faces more charges tomorrow,https://www.malaysiakini.com/news/471247,This is in addition to three charges last week for allegedly duping the project's main contractor.,2019-04-07,07:43:00,2019-04-07 21:20:10
M'sian golfer dies in hotel room during tournament,https://www.malaysiakini.com/news/471242,Arie Irawan, 28, was one of the players at the Sanya Championship in Hainan.,2019-04-07,07:03:00,2019-04-07 21:20:10
Johor MB to meet Mahathir tomorrow, say sources,https://www.malaysiakini.com/news/471238,The meeting comes amid speculation of a reshuffle in the Johor administration.,2019-04-07,06:35:00,2019-04-07 21:20:10
Streram campaign manager denies putting up 'keling' banner,https://www.malaysiakini.com/news/471233,RANTAU POLLS  | U Karunesh says this is an attempt to slander him.,2019-04-07,05:44:00,2019-04-07 21:20:10
Daily 15-minute exercise break for all ministries soon,https://www.malaysiakini.com/news/471230,Civil servants will have to do it in the mornings or evenings, says Health Minister Dzulkefly Ahmad.,2019-04-07,05:12:00,2019-04-07 21:20:10
Hold debate on Rome Statute at all levels of society,https://www.malaysiakini.com/news/471228,COMMENT | Only after extensive debate should be matter be brought before Parliament.,2019-04-07,04:32:00,2019-04-07 21:20:10
'Solo announcement was Dr M's call, not due to cracks in cabinet',https://www.malaysiakini.com/news/471222,INTERVIEW | Foreign minister shares the events leading up to the decision to withdraw from the Rome Statute.,2019-04-07,03:55:00,2019-04-07 21:20:10
Mat Hasan denies wrongdoing in RM10m transfer,https://www.malaysiakini.com/news/471221,UPDATED 12.40PM | RANTAU POLLS | 'There was no abuse of power... I just bought an apartment in London.',2019-04-07,03:52:00,2019-04-07 21:20:10
Dr M: Flip-flops necessary to right wrong decisions made,https://www.malaysiakini.com/news/471220,The premier responds to allegations of his administration going back on many of its electoral promises.,2019-04-07,03:48:00,2019-04-07 21:20:10
Minister confirms ECRL reroute to Negeri if project back on track,https://www.malaysiakini.com/news/471218,RANTAU POLLS | Loke says a decision on whether the project will resume will be made when PM visits China.,2019-04-07,03:32:00,2019-04-07 21:20:10
In astrophysics milestone, first ever photo of black hole expected,https://www.malaysiakini.com/news/471214,Scientists will reveal 'groundbreaking results' from Event Horizon Telescope project this week.,2019-04-07,03:03:00,2019-04-07 21:20:10
Harapan has reduced corruption by about 90pct - Dr M,https://www.malaysiakini.com/news/471213,&nbsp;In an exclusive interview with NST, the premier describes his predecessor Najib Abdul Razak as the 'worst leader'.,2019-04-07,02:57:00,2019-04-07 21:20:10
Venezuelans rally to demand power, water and end to Maduro,https://www.malaysiakini.com/news/471212,Tens of thousands take to the streets to back opposition leader Juan Guaido.,2019-04-07,02:52:00,2019-04-07 21:20:10
After Rome Statute pullout, MP sceptical of refugee treaty being ratified,https://www.malaysiakini.com/news/471209,Charles Santiago says refugees will now have to depend on other international conventions.,2019-04-07,02:23:00,2019-04-07 21:20:11
Netanyahu plans to annex settlements in West Bank if re-elected,https://www.malaysiakini.com/news/471207,Palestinians swiftly condemn the Israeli PM's remarks.,2019-04-07,02:11:00,2019-04-07 21:20:11
Wang Kelian queries raised at George Town refugee festival,https://www.malaysiakini.com/news/471203,Refugee Zahid Alom points out that many of the culprits behind the atrocities remain at large.,2019-04-07,01:49:00,2019-04-07 21:20:11
Saifuddin: People's choice must be defended against the 'deep state',https://www.malaysiakini.com/news/471200,INTERVIEW | Foreign minister stresses the need to defend the democratically elected gov't.,2019-04-07,01:22:00,2019-04-07 21:20:11
PM withdrew from Rome Statute to avoid clash with royals - Anwar,https://www.malaysiakini.com/news/471199,RANTAU POLLS | The rulers had convened and were concerned their powers would be affected, he says.,2019-04-07,00:56:00,2019-04-07 21:20:11
Negeri speaker revives Mat Hasan's RM10m money changer case,https://www.malaysiakini.com/news/471198,Zulkefly Mohamad Omar asks why the former MB has not been arrested.,2019-04-07,00:41:00,2019-04-07 21:20:11
Digital tax rate fixed at 6%,http://www.theedgemarkets.com/article/digital-tax-rate-fixed-6,The digital service tax set to be implemented from Jan 1, 2020 has been fixed at a rate of 6% per annum, with the annual threshold being RM500,000.  ,2019-04-08,12:46:30,2019-04-08 21:19:53
KLCI higher as volume across Bursa swells to 3.87 billion shares,http://www.theedgemarkets.com/article/klci-higher-volume-across-bursa-swells-387-billion-shares,The FBM KLCI closed 2.54 points or 0.15% higher today at 1,644.35 mainly on Maxis Bhd's share price jump in the final trading minutes after the index's volatile trading session.,2019-04-08,10:49:11,2019-04-08 21:19:53
Investors hit pause as central bank and Brexit risks loom,http://www.theedgemarkets.com/article/investors-hit-pause-central-bank-and-brexit-risks-loom,(Apr 8): World stocks paused on Monday after a strong recent run, as potential flashpoints including a crucial Brexit summit and central bank meetings loomed, and investors began to look ahead to an earnings season that may be disappointing.,2019-04-08,09:26:34,2019-04-08 21:19:53
Higher gaming taxes push Genting Malaysia to cut or delay capex,http://www.theedgemarkets.com/article/higher-gaming-taxes-propel-genting-malaysia-cut-or-delay-capex,Genting Malaysia Bhd (GENM) has no choice but to delay or cut its capital expenditure after the steep hike in gaming taxes imposed on the hilltop casino.,2019-04-08,09:10:48,2019-04-08 21:19:53
Sweet-toothed millennials seduce MSM Malaysia to China,http://www.theedgemarkets.com/article/sweettoothed-millennials-seduce-msm-malaysia-china,One of Asia's biggest sugar refiners is in talks to sell the sweetener in China, lured by the country's "new generation" of consumers.,2019-04-08,08:54:45,2019-04-08 21:19:53
China gas demand to surge in 2019, but maybe not enough to sop up LNG glut,http://www.theedgemarkets.com/article/china-gas-demand-surge-2019-maybe-not-enough-sop-lng-glut,SINGAPORE (Apr 8): China's natural gas demand is set to grow by 14 percent in 2019 amid a huge government push to spur consumption of the fuel, a senior industry executive said, requiring the nation to import huge amounts of liquefied natural gas (LNG).,2019-04-08,08:46:10,2019-04-08 21:19:53
SoftBank-backed Grab seeks another US$2b funding in expansion drive,http://www.theedgemarkets.com/article/grab-targets-another-us2b-funding-year-%E2%80%94-ceo,Grab is looking to raise another US$2 billion this year to ramp up expansion, its CEO Anthony Tan told Reuters, just weeks after announcing over US$4.5 billion of funding in what has become Southeast Asia's largest round of private financing.,2019-04-08,07:55:43,2019-04-08 21:19:53
AmBank aims to disburse over RM20b SME loans in next 3 years,http://www.theedgemarkets.com/article/ambank-aims-disburse-over-rm20b-sme-loans-next-3-years,AMMB Holdings Bhd (AmBank Group) is targeting to disburse more than RM20 billion in loans in the next three years to spur development of small and medium sized enterprises (SMEs) in Malaysia.,2019-04-08,07:01:03,2019-04-08 21:19:53
Eversendai gets 3 new Middle East jobs worth RM196m,http://www.theedgemarkets.com/article/eversendai-gets-3-new-middle-east-jobs-worth-rm196m,Eversendai Corp Bhd has clinched three new projects with a combined value of RM196 million in Qatar and Abu Dhabi, the United Arab Emirates.,2019-04-08,05:46:47,2019-04-08 21:19:54
GFM, Hektar REIT, Talamt, Ann Joo, DPS, Hok Heng, Pentamaster, Pesona Metro, Perak Corp, SMTrack, Success Transformer, Sycal,http://www.theedgemarkets.com/article/gfm-hektar-reit-talamt-ann-joo-dps-hok-heng-pentamaster-pesona-metro-perak-corp-smtrack,KUALA LUMPUR (April 8): ,2019-04-08,05:21:56,2019-04-08 21:19:54
11 killed after bus plunged into drain near KLIA,http://www.theedgemarkets.com/article/11-killed-after-bus-plunged-drain-near-klia,Ten foreign workers on their way to work were killed when a bus they were travelling in plunged into a drain near the MASKargo area in Sepang last night.,2019-04-08,04:54:11,2019-04-08 21:19:54
DBKL to potentially recoup RM466m from land deals review, says Khalid,http://www.theedgemarkets.com/article/dbkl-potentially-recoup-rm466m-land-deals-review-says-khalid,The review of 97 Kuala Lumpur City Hall (DBKL) land deals is slated to recoup RM466 million to the Federal Territories Ministry's coffers, said its minister Khalid Abdul Samad.,2019-04-08,04:29:55,2019-04-08 21:19:54
Lynas CEO says identified potential new sites for some processing,http://www.theedgemarkets.com/article/lynas-ceo-says-identified-potential-new-sites-some-processing,Co. has considered five possible locations to carry out some processing under prospective expansion plans, CEO Amanda Lacaze says Monday on a webcast with investors.,2019-04-08,04:22:00,2019-04-08 21:19:54
CIMB IB Research expects higher operating costs, gearing levels for AirAsia till 2021,http://www.theedgemarkets.com/article/cimb-ib-research-expects-higher-operating-costs-gearing-levels-airasia-till-2021,CIMB Investment Bank Research (CIMB IB Research) has retained its "reduce" call on AirAsia Group Bhd as it forecasted the company to face higher operating costs and gearing levels until 2021.,2019-04-08,03:55:42,2019-04-08 21:19:55
Icon Offshore climbs 8.7% after getting jobs to provide vessels,http://www.theedgemarkets.com/article/icon-offshore-climbs-87-after-getting-jobs-provide-vessels,Shares of Icon Offshore Bhd rose as much as 8.7% in active trade this morning after the company announced it secured five contracts and a work order for provision of vessels last Friday (April 5).,2019-04-08,03:17:49,2019-04-08 21:19:55
Gerakan delivers paper model of Lynas factory for Wong Tack to burn,https://www.malaysiakini.com/news/471414,Pahang Gerakan Youth chief says Wong's office did not accept the gift so they just left it by the street.&nbsp;,2019-04-08,12:44:05,2019-04-08 21:19:55
Students behind anti-Rome Statute leak start petition citing MH17,https://www.malaysiakini.com/news/471412,They urge those with 'bad intentions' to stop manipulating the ICC justice system.,2019-04-08,12:07:58,2019-04-08 21:19:55
Ministry denies report on marginalisation of Tamil language,https://www.malaysiakini.com/news/471407,'The Education Ministry has never implemented policies discriminating against any first languages.'&nbsp;,2019-04-08,11:21:42,2019-04-08 21:19:55
Son's drug case: Mat Sabu leaves it to the law,https://www.malaysiakini.com/news/471404,'I leave it to the legal practitioners. There are no comments,' says minister.,2019-04-08,11:08:13,2019-04-08 21:19:55
PAC report on former Perak MB to be tabled in July,https://www.malaysiakini.com/news/471402,PAC conducted the hearing behind closed doors after Zambry refused to attend if it were carried out publicly.,2019-04-08,10:58:25,2019-04-08 21:19:56
Sugar tax will not involve drinks served at eateries - Dzulkefly,https://www.malaysiakini.com/news/471401,It is better to educate the public not to take coloured sweet drinks, says minister.,2019-04-08,10:53:00,2019-04-08 21:19:56
